Exit code: 0
Stdout:
Mejores hiperpar√°metros encontrados:
{'scale': 0.7618528523061175, 'distribution': 'levy', 'gravity': 0.4394330666591304, 'alpha': 0.07095302138357991, 'beta': 2.947662209411072, 'dt': 0.6544253317763055, 'expression': 'best', 'factor': 1.7384587588549414, 'gamma': 21.737245555498273}
Mejor rendimiento encontrado:
151.28206835399482

Stderr:
[I 2025-04-13 19:51:46,098] A new study created in memory with name: no-name-d9a048a1-9472-4f3e-88f7-518de20b87fd
/opt/anaconda3/lib/python3.12/site-packages/optuna/trial/_trial.py:678: RuntimeWarning: Inconsistent parameter values for distribution with name "alpha"! This might be a configuration mistake. Optuna allows to call the same distribution with the same name more than once in a trial. When the parameter values are inconsistent optuna only uses the values of the first call and ignores all following. Using these values: {'step': None, 'low': 0.02, 'high': 0.9, 'log': False}
  warnings.warn(
/opt/anaconda3/lib/python3.12/site-packages/optuna/trial/_trial.py:678: RuntimeWarning: Inconsistent parameter values for distribution with name "beta"! This might be a configuration mistake. Optuna allows to call the same distribution with the same name more than once in a trial. When the parameter values are inconsistent optuna only uses the values of the first call and ignores all following. Using these values: {'step': None, 'low': 1.5, 'high': 4.5, 'log': False}
  warnings.warn(
[I 2025-04-13 19:51:52,350] Trial 0 finished with value: 152.6664715551264 and parameters: {'scale': 0.5168128792904726, 'distribution': 'uniform', 'gravity': 0.46585799621635565, 'alpha': 0.2898401491986907, 'beta': 3.3915429576534466, 'dt': 0.7245535493033807, 'expression': 'current', 'factor': 2.0000025800444075, 'gamma': 11.541612879060954}. Best is trial 0 with value: 152.6664715551264.
[I 2025-04-13 19:51:57,791] Trial 1 finished with value: 151.28206835399482 and parameters: {'scale': 0.7618528523061175, 'distribution': 'levy', 'gravity': 0.4394330666591304, 'alpha': 0.07095302138357991, 'beta': 2.947662209411072, 'dt': 0.6544253317763055, 'expression': 'best', 'factor': 1.7384587588549414, 'gamma': 21.737245555498273}. Best is trial 1 with value: 151.28206835399482.
[I 2025-04-13 19:52:03,213] Trial 2 finished with value: 151.8726679591254 and parameters: {'scale': 0.4290488982169102, 'distribution': 'levy', 'gravity': 0.8306730015610678, 'alpha': 0.048029243766856786, 'beta': 2.235276122849823, 'dt': 0.8686023417537351, 'expression': 'rand-to-best', 'factor': 2.576782348514519, 'gamma': 34.61147518142164}. Best is trial 1 with value: 151.28206835399482.
[I 2025-04-13 19:52:08,680] Trial 3 finished with value: 159.57589766425778 and parameters: {'scale': 0.10573419427871449, 'distribution': 'gaussian', 'gravity': 0.680627244232301, 'alpha': 0.6990352147817713, 'beta': 4.371567357425736, 'dt': 0.9523306612470841, 'expression': 'current-to-best', 'factor': 1.5347161494756105, 'gamma': 39.37511129212193}. Best is trial 1 with value: 151.28206835399482.
[I 2025-04-13 19:52:14,108] Trial 4 finished with value: 154.12644298552698 and parameters: {'scale': 0.37179243470819917, 'distribution': 'levy', 'gravity': 0.8220094418559464, 'alpha': 0.154042754486486, 'beta': 4.330794105721576, 'dt': 0.14743684129518853, 'expression': 'current-to-best', 'factor': 2.8596368764422495, 'gamma': 24.5906400204677}. Best is trial 1 with value: 151.28206835399482.
[I 2025-04-13 19:52:19,512] Trial 5 finished with value: 156.9174721341625 and parameters: {'scale': 0.35457280122201357, 'distribution': 'gaussian', 'gravity': 0.29814166582543383, 'alpha': 0.6957742308264756, 'beta': 2.9768488178777703, 'dt': 0.7658074212547397, 'expression': 'current-to-best', 'factor': 2.3860989207983296, 'gamma': 45.84942055350522}. Best is trial 1 with value: 151.28206835399482.
[I 2025-04-13 19:52:24,889] Trial 6 finished with value: 160.06911590178444 and parameters: {'scale': 0.19872091544908174, 'distribution': 'levy', 'gravity': 0.3483529359036895, 'alpha': 0.7622369491936107, 'beta': 2.6617930690996117, 'dt': 0.8464387094284803, 'expression': 'best', 'factor': 2.3057393583146544, 'gamma': 51.80428110234018}. Best is trial 1 with value: 151.28206835399482.
[I 2025-04-13 19:52:30,330] Trial 7 finished with value: 152.2211156648632 and parameters: {'scale': 0.2536649758467464, 'distribution': 'levy', 'gravity': 0.11524189206060274, 'alpha': 0.3080872129537105, 'beta': 3.689624232500596, 'dt': 0.9128944592120839, 'expression': 'rand-to-best-and-current', 'factor': 1.3668191063148492, 'gamma': 40.38947697739267}. Best is trial 1 with value: 151.28206835399482.
[I 2025-04-13 19:52:35,688] Trial 8 finished with value: 154.25753475468414 and parameters: {'scale': 0.4937612005492761, 'distribution': 'gaussian', 'gravity': 0.2635800953107325, 'alpha': 0.615264069751179, 'beta': 1.8861117941656522, 'dt': 0.7818467699533047, 'expression': 'rand-to-best-and-current', 'factor': 2.6843025485814653, 'gamma': 32.40554011253899}. Best is trial 1 with value: 151.28206835399482.
[I 2025-04-13 19:52:41,857] Trial 9 finished with value: 153.84457580775535 and parameters: {'scale': 0.7733423987175588, 'distribution': 'uniform', 'gravity': 0.5332399406140067, 'alpha': 0.573051602821631, 'beta': 3.2257628392920914, 'dt': 0.2733779187940328, 'expression': 'rand', 'factor': 1.1909018491879564, 'gamma': 35.65651257631231}. Best is trial 1 with value: 151.28206835399482.
