Exit code: 0
Stdout:
Mejores hiperpar√°metros encontrados:
{'scale': 0.00754826035017058, 'distribution': 'gaussian', 'gravity': 0.005675053496471284, 'alpha': 0.0116415261478257, 'beta': 1.6291427099162488, 'dt': 0.47119902041637096, 'expression': 'rand', 'num_rands': 3, 'factor': 1.3580728970762141}
Mejor rendimiento encontrado:
92.94

Stderr:
[I 2025-02-08 12:36:34,873] A new study created in memory with name: no-name-9f7eddf2-1408-450e-bf97-1f906b6e6d18
/Users/valeriaenriquezlimon/Documents/meta-h-generator/llm-metaheuristics/.venv/lib/python3.12/site-packages/optuna/trial/_trial.py:678: RuntimeWarning: Inconsistent parameter values for distribution with name "gravity"! This might be a configuration mistake. Optuna allows to call the same distribution with the same name more than once in a trial. When the parameter values are inconsistent optuna only uses the values of the first call and ignores all following. Using these values: {'step': None, 'low': 0.001, 'high': 0.01, 'log': False}
  warnings.warn(
/Users/valeriaenriquezlimon/Documents/meta-h-generator/llm-metaheuristics/.venv/lib/python3.12/site-packages/optuna/trial/_trial.py:678: RuntimeWarning: Inconsistent parameter values for distribution with name "alpha"! This might be a configuration mistake. Optuna allows to call the same distribution with the same name more than once in a trial. When the parameter values are inconsistent optuna only uses the values of the first call and ignores all following. Using these values: {'step': None, 'low': 0.01, 'high': 0.03, 'log': False}
  warnings.warn(
[I 2025-02-08 12:36:39,859] Trial 0 finished with value: 92.94 and parameters: {'scale': 0.00754826035017058, 'distribution': 'gaussian', 'gravity': 0.005675053496471284, 'alpha': 0.0116415261478257, 'beta': 1.6291427099162488, 'dt': 0.47119902041637096, 'expression': 'rand', 'num_rands': 3, 'factor': 1.3580728970762141}. Best is trial 0 with value: 92.94.
[I 2025-02-08 12:36:44,853] Trial 1 finished with value: 92.94242088654443 and parameters: {'scale': 0.008262619463518835, 'distribution': 'levy', 'gravity': 0.0050404172932375065, 'alpha': 0.013676160415491436, 'beta': 2.89813282177641, 'dt': 0.4202103939034832, 'expression': 'current-to-best', 'num_rands': 2, 'factor': 0.8382425993438851}. Best is trial 0 with value: 92.94.
[I 2025-02-08 12:36:50,179] Trial 2 finished with value: 92.94 and parameters: {'scale': 0.0038985966552374874, 'distribution': 'levy', 'gravity': 0.00394497013312135, 'alpha': 0.021987230138852856, 'beta': 1.7145671416821413, 'dt': 0.7120749128452368, 'expression': 'rand-to-best', 'num_rands': 2, 'factor': 1.1921239814385232}. Best is trial 0 with value: 92.94.
[I 2025-02-08 12:36:55,297] Trial 3 finished with value: 92.94898809856659 and parameters: {'scale': 0.016146215085493243, 'distribution': 'levy', 'gravity': 0.008970617735511357, 'alpha': 0.027496707756014614, 'beta': 3.914206353804074, 'dt': 0.685915300026898, 'expression': 'rand-to-best', 'num_rands': 1, 'factor': 1.3795566231518672}. Best is trial 0 with value: 92.94.
[I 2025-02-08 12:37:00,385] Trial 4 finished with value: 92.94 and parameters: {'scale': 0.005078564039760956, 'distribution': 'uniform', 'gravity': 0.006391321752452942, 'alpha': 0.011972136339332366, 'beta': 2.435126634356773, 'dt': 0.39669501596421747, 'expression': 'rand', 'num_rands': 2, 'factor': 0.931988653046086}. Best is trial 0 with value: 92.94.
[I 2025-02-08 12:37:05,394] Trial 5 finished with value: 92.96281349014716 and parameters: {'scale': 0.006078513124633092, 'distribution': 'levy', 'gravity': 0.003946890038025631, 'alpha': 0.022841595956896915, 'beta': 4.287029686709479, 'dt': 0.412237038500436, 'expression': 'rand-to-best-and-current', 'num_rands': 1, 'factor': 0.8915760991111199}. Best is trial 0 with value: 92.94.
[I 2025-02-08 12:37:10,610] Trial 6 finished with value: 92.94322784872591 and parameters: {'scale': 0.0028464475581577386, 'distribution': 'levy', 'gravity': 0.00686678007077953, 'alpha': 0.017379469706931047, 'beta': 3.3752852924342465, 'dt': 0.27584908062849695, 'expression': 'best', 'num_rands': 2, 'factor': 1.1581785506159996}. Best is trial 0 with value: 92.94.
[I 2025-02-08 12:37:15,724] Trial 7 finished with value: 92.94484177308887 and parameters: {'scale': 0.012606549329558552, 'distribution': 'uniform', 'gravity': 0.0066863608046501405, 'alpha': 0.015570779132545395, 'beta': 3.398498642014703, 'dt': 0.49049345415464296, 'expression': 'rand-to-best-and-current', 'num_rands': 3, 'factor': 0.9027053422095301}. Best is trial 0 with value: 92.94.
[I 2025-02-08 12:37:20,900] Trial 8 finished with value: 92.94 and parameters: {'scale': 0.018595290134533832, 'distribution': 'levy', 'gravity': 0.0011194061198244911, 'alpha': 0.024650748237251288, 'beta': 3.6781849842683436, 'dt': 0.3784135155331945, 'expression': 'best', 'num_rands': 1, 'factor': 1.118300564899178}. Best is trial 0 with value: 92.94.
[I 2025-02-08 12:37:26,117] Trial 9 finished with value: 92.94 and parameters: {'scale': 0.011829750925527942, 'distribution': 'gaussian', 'gravity': 0.006817995912575147, 'alpha': 0.010600636987134022, 'beta': 1.8211748492046147, 'dt': 0.6617182817077905, 'expression': 'rand-to-best', 'num_rands': 3, 'factor': 1.2432344466902092}. Best is trial 0 with value: 92.94.
