Exit code: 0
Stdout:
Mejores hiperpar√°metros encontrados:
{'scale': 0.6922102169416083, 'distribution': 'uniform', 'alpha': 0.1127616451886454, 'beta': 1.001402210711944, 'gamma': 83.90024318347375}
Mejor rendimiento encontrado:
5.143351962522562

Stderr:
[I 2024-12-30 20:57:35,804] A new study created in memory with name: no-name-8ef23fba-c6c4-4baf-87f8-c8f1130e1b79
[I 2024-12-30 20:57:38,537] Trial 0 finished with value: 13.147830425778148 and parameters: {'scale': 0.3270281919036432, 'distribution': 'gaussian', 'alpha': 0.9885069656902994, 'beta': 2.2868213990318544, 'gamma': 192.51494912886793}. Best is trial 0 with value: 13.147830425778148.
[I 2024-12-30 20:57:38,962] Trial 1 finished with value: 9.925834725704556 and parameters: {'scale': 0.525828935680979, 'distribution': 'gaussian', 'alpha': 0.7236309223372117, 'beta': 2.9247463047869107, 'gamma': 130.3578064825151}. Best is trial 1 with value: 9.925834725704556.
[I 2024-12-30 20:57:39,376] Trial 2 finished with value: 10.420003208884705 and parameters: {'scale': 0.35564604140473155, 'distribution': 'levy', 'alpha': 0.2542013880982203, 'beta': 2.7856427533750923, 'gamma': 183.99867635697746}. Best is trial 1 with value: 9.925834725704556.
[I 2024-12-30 20:57:39,758] Trial 3 finished with value: 7.696819931477047 and parameters: {'scale': 0.38775616231540355, 'distribution': 'uniform', 'alpha': 0.5582614425743732, 'beta': 2.669779987040214, 'gamma': 160.5030069853235}. Best is trial 3 with value: 7.696819931477047.
[I 2024-12-30 20:57:40,145] Trial 4 finished with value: 11.109533310949253 and parameters: {'scale': 0.2645856814482796, 'distribution': 'levy', 'alpha': 0.6812296885033962, 'beta': 2.933176535433269, 'gamma': 170.23594649816368}. Best is trial 3 with value: 7.696819931477047.
[I 2024-12-30 20:57:40,551] Trial 5 finished with value: 6.075785604959222 and parameters: {'scale': 0.56950347220669, 'distribution': 'uniform', 'alpha': 0.1814462743156573, 'beta': 1.5296829210226484, 'gamma': 151.26078432235747}. Best is trial 5 with value: 6.075785604959222.
[I 2024-12-30 20:57:40,955] Trial 6 finished with value: 12.81191787738462 and parameters: {'scale': 0.2462848280579044, 'distribution': 'levy', 'alpha': 0.76917178862665, 'beta': 2.685758790565776, 'gamma': 34.57817313895281}. Best is trial 5 with value: 6.075785604959222.
[I 2024-12-30 20:57:41,297] Trial 7 finished with value: 13.510730137418275 and parameters: {'scale': 0.5083900822939009, 'distribution': 'levy', 'alpha': 0.792606389431313, 'beta': 1.496697341190137, 'gamma': 106.26343386469554}. Best is trial 5 with value: 6.075785604959222.
[I 2024-12-30 20:57:41,640] Trial 8 finished with value: 8.737740384090031 and parameters: {'scale': 0.8553843725594864, 'distribution': 'uniform', 'alpha': 0.699900333041588, 'beta': 1.4416791965823383, 'gamma': 163.3647107734481}. Best is trial 5 with value: 6.075785604959222.
[I 2024-12-30 20:57:41,979] Trial 9 finished with value: 7.860107329712747 and parameters: {'scale': 0.8253950850740427, 'distribution': 'uniform', 'alpha': 0.9473738307055376, 'beta': 1.9280044283263673, 'gamma': 148.99290438752075}. Best is trial 5 with value: 6.075785604959222.
[I 2024-12-30 20:57:42,333] Trial 10 finished with value: 5.566320041379103 and parameters: {'scale': 0.6557593262846939, 'distribution': 'uniform', 'alpha': 0.15305991693823717, 'beta': 1.8852478399365178, 'gamma': 86.32992820175299}. Best is trial 10 with value: 5.566320041379103.
[I 2024-12-30 20:57:42,675] Trial 11 finished with value: 5.143351962522562 and parameters: {'scale': 0.6922102169416083, 'distribution': 'uniform', 'alpha': 0.1127616451886454, 'beta': 1.001402210711944, 'gamma': 83.90024318347375}. Best is trial 11 with value: 5.143351962522562.
[I 2024-12-30 20:57:43,035] Trial 12 finished with value: 6.225181668929711 and parameters: {'scale': 0.7102954856492858, 'distribution': 'uniform', 'alpha': 0.3128191685960824, 'beta': 1.0599574793527298, 'gamma': 78.4129213061687}. Best is trial 11 with value: 5.143351962522562.
[I 2024-12-30 20:57:43,371] Trial 13 finished with value: 5.322086222755927 and parameters: {'scale': 0.6770371866042858, 'distribution': 'uniform', 'alpha': 0.11718907710167108, 'beta': 1.0006575894387957, 'gamma': 77.18076768057809}. Best is trial 11 with value: 5.143351962522562.
[I 2024-12-30 20:57:43,704] Trial 14 finished with value: 6.192291281311277 and parameters: {'scale': 0.7196162348617909, 'distribution': 'uniform', 'alpha': 0.4123599741242888, 'beta': 1.0390683985602236, 'gamma': 51.42212523121915}. Best is trial 11 with value: 5.143351962522562.
