Exit code: 0
Stdout:
Mejores hiperpar√°metros encontrados:
{'scale': 0.06329438564391315, 'distribution': 'levy', 'gravity': 0.043412921775402874, 'alpha': 0.014925822898347136, 'beta': 1.702263256179907, 'dt': 0.5403670778921372, 'expression': 'rand-to-best-and-current', 'factor': 1.5028476425165236}
Mejor rendimiento encontrado:
-163.20118261441428

Stderr:
[I 2025-01-28 17:24:26,709] A new study created in memory with name: no-name-67cb3fff-4fe3-47af-aa36-001bffed364c
/Users/valeriaenriquezlimon/Documents/meta-h-generator/llm-metaheuristics/.venv/lib/python3.12/site-packages/optuna/trial/_trial.py:678: RuntimeWarning: Inconsistent parameter values for distribution with name "gravity"! This might be a configuration mistake. Optuna allows to call the same distribution with the same name more than once in a trial. When the parameter values are inconsistent optuna only uses the values of the first call and ignores all following. Using these values: {'step': None, 'low': 0.01, 'high': 0.2, 'log': False}
  warnings.warn(
/Users/valeriaenriquezlimon/Documents/meta-h-generator/llm-metaheuristics/.venv/lib/python3.12/site-packages/optuna/trial/_trial.py:678: RuntimeWarning: Inconsistent parameter values for distribution with name "alpha"! This might be a configuration mistake. Optuna allows to call the same distribution with the same name more than once in a trial. When the parameter values are inconsistent optuna only uses the values of the first call and ignores all following. Using these values: {'step': None, 'low': 0.01, 'high': 0.05, 'log': False}
  warnings.warn(
[I 2025-01-28 17:24:38,868] Trial 0 finished with value: -163.20118261441428 and parameters: {'scale': 0.06329438564391315, 'distribution': 'levy', 'gravity': 0.043412921775402874, 'alpha': 0.014925822898347136, 'beta': 1.702263256179907, 'dt': 0.5403670778921372, 'expression': 'rand-to-best-and-current', 'factor': 1.5028476425165236}. Best is trial 0 with value: -163.20118261441428.
[I 2025-01-28 17:24:51,020] Trial 1 finished with value: -49.77979105694345 and parameters: {'scale': 0.03991759622562752, 'distribution': 'levy', 'gravity': 0.15350305709482223, 'alpha': 0.049118425351785455, 'beta': 1.8978775996628776, 'dt': 0.37772224373509444, 'expression': 'rand', 'factor': 1.1370853639984007}. Best is trial 0 with value: -163.20118261441428.
[I 2025-01-28 17:25:03,108] Trial 2 finished with value: 1051.3633795425915 and parameters: {'scale': 0.07416632056363161, 'distribution': 'uniform', 'gravity': 0.13655908355447954, 'alpha': 0.013106727240159835, 'beta': 3.26338604312713, 'dt': 0.772206318441823, 'expression': 'current', 'factor': 1.1747778360315109}. Best is trial 0 with value: -163.20118261441428.
[I 2025-01-28 17:25:15,056] Trial 3 finished with value: 484.5207890976109 and parameters: {'scale': 0.07606901129607507, 'distribution': 'gaussian', 'gravity': 0.12402841392667495, 'alpha': 0.04060014868401568, 'beta': 3.1851989682350443, 'dt': 0.25755701909275897, 'expression': 'rand', 'factor': 1.7767202487512883}. Best is trial 0 with value: -163.20118261441428.
[I 2025-01-28 17:25:26,947] Trial 4 finished with value: 435.2257800827806 and parameters: {'scale': 0.020585076174992008, 'distribution': 'uniform', 'gravity': 0.10997233431280802, 'alpha': 0.010499706107034523, 'beta': 4.255776733925455, 'dt': 0.6758872215469631, 'expression': 'best', 'factor': 1.8665752735224923}. Best is trial 0 with value: -163.20118261441428.
[I 2025-01-28 17:25:38,936] Trial 5 finished with value: 1015.8066484113997 and parameters: {'scale': 0.0547880289829819, 'distribution': 'uniform', 'gravity': 0.13837836832089503, 'alpha': 0.04233261336182981, 'beta': 4.1772871166768075, 'dt': 0.6701174277754569, 'expression': 'current-to-best', 'factor': 1.7400134393111202}. Best is trial 0 with value: -163.20118261441428.
[I 2025-01-28 17:25:50,801] Trial 6 finished with value: 216.74446060732873 and parameters: {'scale': 0.011246371688802806, 'distribution': 'gaussian', 'gravity': 0.11544950949425435, 'alpha': 0.010876523009852299, 'beta': 2.8432785552956825, 'dt': 0.9861303176506654, 'expression': 'best', 'factor': 1.3671603423230043}. Best is trial 0 with value: -163.20118261441428.
[I 2025-01-28 17:26:02,811] Trial 7 finished with value: 417.35162072651576 and parameters: {'scale': 0.08512422480843752, 'distribution': 'levy', 'gravity': 0.13055692725255386, 'alpha': 0.029304304759621813, 'beta': 3.4591632758967092, 'dt': 0.3685807908522011, 'expression': 'current', 'factor': 1.8359594353005577}. Best is trial 0 with value: -163.20118261441428.
[I 2025-01-28 17:26:14,757] Trial 8 finished with value: 1037.002858847462 and parameters: {'scale': 0.08571068750552084, 'distribution': 'uniform', 'gravity': 0.16927645923948126, 'alpha': 0.03120730815402248, 'beta': 4.0112379348133125, 'dt': 0.8799960289031726, 'expression': 'current', 'factor': 1.2273186407127215}. Best is trial 0 with value: -163.20118261441428.
[I 2025-01-28 17:26:26,819] Trial 9 finished with value: -140.59561247551383 and parameters: {'scale': 0.033559705334856735, 'distribution': 'gaussian', 'gravity': 0.06282902068734784, 'alpha': 0.03151278509627674, 'beta': 2.0079888343882626, 'dt': 0.6881302456435062, 'expression': 'rand', 'factor': 1.5918249396776187}. Best is trial 0 with value: -163.20118261441428.
