Exit code: 0
Stdout:
Mejores hiperpar√°metros encontrados:
{'scale': 0.04807243144765401, 'distribution': 'gaussian', 'gravity': 0.2759762660019394, 'alpha': 0.06985716738301248, 'beta': 1.6304098200097665, 'dt': 0.6472712482823408, 'expression': 'best', 'num_rands': 3, 'factor': 1.2790010013293518}
Mejor rendimiento encontrado:
-9.21

Stderr:
[I 2025-01-23 17:58:41,849] A new study created in memory with name: no-name-22dc60d0-1363-4328-bc5e-3dd76e913385
/Users/valeriaenriquezlimon/Documents/meta-h-generator/llm-metaheuristics/.venv/lib/python3.12/site-packages/optuna/trial/_trial.py:678: RuntimeWarning: Inconsistent parameter values for distribution with name "gravity"! This might be a configuration mistake. Optuna allows to call the same distribution with the same name more than once in a trial. When the parameter values are inconsistent optuna only uses the values of the first call and ignores all following. Using these values: {'step': None, 'low': 0.001, 'high': 0.5, 'log': False}
  warnings.warn(
/Users/valeriaenriquezlimon/Documents/meta-h-generator/llm-metaheuristics/.venv/lib/python3.12/site-packages/optuna/trial/_trial.py:678: RuntimeWarning: Inconsistent parameter values for distribution with name "alpha"! This might be a configuration mistake. Optuna allows to call the same distribution with the same name more than once in a trial. When the parameter values are inconsistent optuna only uses the values of the first call and ignores all following. Using these values: {'step': None, 'low': 0.01, 'high': 0.2, 'log': False}
  warnings.warn(
[I 2025-01-23 17:58:52,352] Trial 0 finished with value: -9.21 and parameters: {'scale': 0.04807243144765401, 'distribution': 'gaussian', 'gravity': 0.2759762660019394, 'alpha': 0.06985716738301248, 'beta': 1.6304098200097665, 'dt': 0.6472712482823408, 'expression': 'best', 'num_rands': 3, 'factor': 1.2790010013293518}. Best is trial 0 with value: -9.21.
[I 2025-01-23 17:59:02,718] Trial 1 finished with value: -9.21 and parameters: {'scale': 0.06518497351633887, 'distribution': 'levy', 'gravity': 0.23754477023451834, 'alpha': 0.15233564044812983, 'beta': 2.607403436439254, 'dt': 1.4571405339607886, 'expression': 'rand-to-best-and-current', 'num_rands': 1, 'factor': 1.9901315190537099}. Best is trial 0 with value: -9.21.
[I 2025-01-23 17:59:13,022] Trial 2 finished with value: -9.21 and parameters: {'scale': 0.07101739387524816, 'distribution': 'levy', 'gravity': 0.16266604872810472, 'alpha': 0.1790414222692227, 'beta': 3.960846110380407, 'dt': 1.0139082235187564, 'expression': 'best', 'num_rands': 2, 'factor': 1.805740193402233}. Best is trial 0 with value: -9.21.
[I 2025-01-23 17:59:23,422] Trial 3 finished with value: -9.21 and parameters: {'scale': 0.004866988298800137, 'distribution': 'gaussian', 'gravity': 0.1668032769740777, 'alpha': 0.18317700897616954, 'beta': 2.7506022984976184, 'dt': 1.73005034629081, 'expression': 'rand-to-best-and-current', 'num_rands': 3, 'factor': 1.2043445615035733}. Best is trial 0 with value: -9.21.
[I 2025-01-23 17:59:33,844] Trial 4 finished with value: -9.21 and parameters: {'scale': 0.038879608879646844, 'distribution': 'levy', 'gravity': 0.1462846261876299, 'alpha': 0.0922922019730056, 'beta': 1.5648594895601335, 'dt': 1.205343499334533, 'expression': 'rand-to-best-and-current', 'num_rands': 1, 'factor': 1.8243241280426237}. Best is trial 0 with value: -9.21.
[I 2025-01-23 17:59:44,066] Trial 5 finished with value: -9.21 and parameters: {'scale': 0.03109423604417558, 'distribution': 'gaussian', 'gravity': 0.03270652981482217, 'alpha': 0.10723648551170553, 'beta': 2.049138801359967, 'dt': 1.7639969578160675, 'expression': 'current', 'num_rands': 1, 'factor': 1.6710550761100544}. Best is trial 0 with value: -9.21.
[I 2025-01-23 17:59:54,386] Trial 6 finished with value: -9.21 and parameters: {'scale': 0.07575846403763153, 'distribution': 'uniform', 'gravity': 0.3135784995310478, 'alpha': 0.165482375022509, 'beta': 2.487098289866635, 'dt': 1.3627523879097603, 'expression': 'current-to-best', 'num_rands': 2, 'factor': 1.84962849794929}. Best is trial 0 with value: -9.21.
[I 2025-01-23 18:00:04,735] Trial 7 finished with value: -9.21 and parameters: {'scale': 0.015213883248406515, 'distribution': 'uniform', 'gravity': 0.22150090247328594, 'alpha': 0.14100494842460665, 'beta': 2.0842752081667437, 'dt': 1.1806100662966765, 'expression': 'rand-to-best-and-current', 'num_rands': 2, 'factor': 1.25541756855849}. Best is trial 0 with value: -9.21.
[I 2025-01-23 18:00:14,997] Trial 8 finished with value: -9.21 and parameters: {'scale': 0.05637408601013243, 'distribution': 'levy', 'gravity': 0.048401899697371374, 'alpha': 0.07610913573362685, 'beta': 3.2881289020496616, 'dt': 1.1760911263160714, 'expression': 'current-to-best', 'num_rands': 2, 'factor': 1.2503047544192092}. Best is trial 0 with value: -9.21.
[I 2025-01-23 18:00:25,353] Trial 9 finished with value: -9.21 and parameters: {'scale': 0.045593607461981156, 'distribution': 'uniform', 'gravity': 0.0346799401347264, 'alpha': 0.030002554876771254, 'beta': 4.442224287881012, 'dt': 1.4528252336222833, 'expression': 'rand-to-best-and-current', 'num_rands': 1, 'factor': 1.070297768538289}. Best is trial 0 with value: -9.21.
