Exit code: 0
Stdout:
Mejores hiperpar√°metros encontrados:
{'scale': 0.013688065650422899, 'gravity': 0.160574742173, 'alpha': 0.24053438007775524, 'beta': 2.188245155843549, 'dt': 1.2822613557194207, 'distribution': 'uniform', 'gamma': 231.08826763572395, 'radius': 0.7066921787922009, 'angle': 24.506398953527707, 'sigma': 0.07889413507664425}
Mejor rendimiento encontrado:
1001.094512084783

Stderr:
[I 2025-04-01 11:21:06,861] A new study created in memory with name: no-name-f7744d8a-13c8-414d-90e2-bd31bee4a205
/Users/valeriaenriquezlimon/Documents/meta-h-generator/llm-metaheuristics/.venv/lib/python3.12/site-packages/optuna/trial/_trial.py:678: RuntimeWarning: Inconsistent parameter values for distribution with name "alpha"! This might be a configuration mistake. Optuna allows to call the same distribution with the same name more than once in a trial. When the parameter values are inconsistent optuna only uses the values of the first call and ignores all following. Using these values: {'step': None, 'low': 0.02, 'high': 0.4, 'log': False}
  warnings.warn(
/Users/valeriaenriquezlimon/Documents/meta-h-generator/llm-metaheuristics/.venv/lib/python3.12/site-packages/optuna/trial/_trial.py:678: RuntimeWarning: Inconsistent parameter values for distribution with name "beta"! This might be a configuration mistake. Optuna allows to call the same distribution with the same name more than once in a trial. When the parameter values are inconsistent optuna only uses the values of the first call and ignores all following. Using these values: {'step': None, 'low': 1.5, 'high': 4.5, 'log': False}
  warnings.warn(
[I 2025-04-01 11:21:12,711] Trial 0 finished with value: 1001.4278948876231 and parameters: {'scale': 0.1299701754422045, 'gravity': 0.04943990140569303, 'alpha': 0.06743213759378035, 'beta': 4.450183989054977, 'dt': 1.2031631795751405, 'distribution': 'levy', 'gamma': 196.49126597642996, 'radius': 0.8447480756311985, 'angle': 23.76797913150177, 'sigma': 0.07846291735879315}. Best is trial 0 with value: 1001.4278948876231.
[I 2025-04-01 11:21:18,421] Trial 1 finished with value: 1001.5550802564725 and parameters: {'scale': 0.015203693883016296, 'gravity': 0.1734155102198082, 'alpha': 0.044322729268176354, 'beta': 4.162791893970465, 'dt': 1.2176435692646033, 'distribution': 'gaussian', 'gamma': 273.84997009007355, 'radius': 0.8818610152129365, 'angle': 21.97248162065426, 'sigma': 0.09472163715926608}. Best is trial 0 with value: 1001.4278948876231.
[I 2025-04-01 11:21:24,193] Trial 2 finished with value: 1003.0997761736944 and parameters: {'scale': 0.4780580974488451, 'gravity': 0.05744702269594408, 'alpha': 0.29272979880251265, 'beta': 2.7994134661299364, 'dt': 1.3095824759475982, 'distribution': 'gaussian', 'gamma': 246.86675454218297, 'radius': 0.8868019643657253, 'angle': 24.894801620666225, 'sigma': 0.08781223435160518}. Best is trial 0 with value: 1001.4278948876231.
[I 2025-04-01 11:21:29,975] Trial 3 finished with value: 1001.8990387196769 and parameters: {'scale': 0.21746962196739966, 'gravity': 0.10464320053037053, 'alpha': 0.1441805720631513, 'beta': 3.56062146913327, 'dt': 1.6329184704949222, 'distribution': 'gaussian', 'gamma': 275.4095560858766, 'radius': 0.829800840480406, 'angle': 20.76321422104565, 'sigma': 0.06852752851248486}. Best is trial 0 with value: 1001.4278948876231.
[I 2025-04-01 11:21:35,695] Trial 4 finished with value: 1002.6279488401277 and parameters: {'scale': 0.2845890671168485, 'gravity': 0.04575124394357695, 'alpha': 0.022957679233750694, 'beta': 3.024691966445779, 'dt': 1.42221393129685, 'distribution': 'gaussian', 'gamma': 130.68488009543813, 'radius': 0.7969159917767938, 'angle': 21.81238161379063, 'sigma': 0.07947689855521477}. Best is trial 0 with value: 1001.4278948876231.
[I 2025-04-01 11:21:41,523] Trial 5 finished with value: 1003.1428966592499 and parameters: {'scale': 0.43190025074447563, 'gravity': 0.11945966836381505, 'alpha': 0.20287505977455475, 'beta': 2.188573189401585, 'dt': 1.6405753013272455, 'distribution': 'levy', 'gamma': 296.2848818102907, 'radius': 0.8053142642624078, 'angle': 23.041248803640975, 'sigma': 0.08407914501544994}. Best is trial 0 with value: 1001.4278948876231.
[I 2025-04-01 11:21:47,276] Trial 6 finished with value: 1003.1417109223142 and parameters: {'scale': 0.23919672213488835, 'gravity': 0.16926877850759714, 'alpha': 0.3990521102817336, 'beta': 3.705976561086276, 'dt': 1.7645482846787472, 'distribution': 'gaussian', 'gamma': 244.6574931102503, 'radius': 0.8736329007427219, 'angle': 23.3146402175419, 'sigma': 0.08956967915482664}. Best is trial 0 with value: 1001.4278948876231.
[I 2025-04-01 11:21:52,983] Trial 7 finished with value: 1001.094512084783 and parameters: {'scale': 0.013688065650422899, 'gravity': 0.160574742173, 'alpha': 0.24053438007775524, 'beta': 2.188245155843549, 'dt': 1.2822613557194207, 'distribution': 'uniform', 'gamma': 231.08826763572395, 'radius': 0.7066921787922009, 'angle': 24.506398953527707, 'sigma': 0.07889413507664425}. Best is trial 7 with value: 1001.094512084783.
[I 2025-04-01 11:21:58,846] Trial 8 finished with value: 1002.3428844642317 and parameters: {'scale': 0.21314754469454497, 'gravity': 0.05370747803052322, 'alpha': 0.22956810072837636, 'beta': 2.1218307429295145, 'dt': 1.7186351140824563, 'distribution': 'gaussian', 'gamma': 104.45103492132284, 'radius': 0.7071472303992669, 'angle': 23.80203073315843, 'sigma': 0.05075656507922269}. Best is trial 7 with value: 1001.094512084783.
[I 2025-04-01 11:22:04,728] Trial 9 finished with value: 1001.4039315713383 and parameters: {'scale': 0.15813037185863088, 'gravity': 0.10013437985539894, 'alpha': 0.02875400702180542, 'beta': 1.648051369729413, 'dt': 1.9541157738305475, 'distribution': 'levy', 'gamma': 213.6740636217804, 'radius': 0.7700318836946733, 'angle': 21.795897350400445, 'sigma': 0.07465081552780156}. Best is trial 7 with value: 1001.094512084783.
