Exit code: 0
Stdout:
Mejores hiperpar√°metros encontrados:
{'radius': 0.6821219161606836, 'angle': 20.171533219750003, 'sigma': 0.023029660128909286, 'probability': 0.3445932271336794, 'scale': 1.0621651591134849, 'distribution': 'uniform'}
Mejor rendimiento encontrado:
64.72077481280822

Stderr:
[I 2024-11-26 01:47:16,382] A new study created in memory with name: no-name-49335472-398e-4000-a843-35f370ae2ac7
[I 2024-11-26 01:47:19,912] Trial 0 finished with value: 84.127898267808 and parameters: {'radius': 0.5623602004265567, 'angle': 24.56707243072511, 'sigma': 0.10030150336214538, 'probability': 0.5142960397046978, 'scale': 0.6755570725202459, 'distribution': 'gaussian'}. Best is trial 0 with value: 84.127898267808.
[I 2024-11-26 01:47:21,093] Trial 1 finished with value: 70.70611791718673 and parameters: {'radius': 0.3949793105405662, 'angle': 20.835911967524943, 'sigma': 0.27650612247531353, 'probability': 0.7107336704757796, 'scale': 1.2236770210150778, 'distribution': 'gaussian'}. Best is trial 1 with value: 70.70611791718673.
[I 2024-11-26 01:47:22,327] Trial 2 finished with value: 108.90358519047575 and parameters: {'radius': 0.1859787400613814, 'angle': 20.980430228974544, 'sigma': 0.0778745896241075, 'probability': 0.7104486513853006, 'scale': 1.2754724397927526, 'distribution': 'gaussian'}. Best is trial 1 with value: 70.70611791718673.
[I 2024-11-26 01:47:23,580] Trial 3 finished with value: 83.26315128554376 and parameters: {'radius': 0.5209478705159515, 'angle': 23.344672513885016, 'sigma': 0.2827494905046665, 'probability': 0.5913950950737301, 'scale': 1.0871279823480848, 'distribution': 'uniform'}. Best is trial 1 with value: 70.70611791718673.
[I 2024-11-26 01:47:24,791] Trial 4 finished with value: 80.32759677658498 and parameters: {'radius': 0.47882726722537133, 'angle': 24.678241498574835, 'sigma': 0.26588358533973355, 'probability': 0.43590490540169025, 'scale': 0.9901594915695369, 'distribution': 'uniform'}. Best is trial 1 with value: 70.70611791718673.
[I 2024-11-26 01:47:26,042] Trial 5 finished with value: 108.24662779514635 and parameters: {'radius': 0.22589200485939165, 'angle': 22.46001417201348, 'sigma': 0.19055184231587038, 'probability': 0.6834159559077115, 'scale': 0.7611913189771178, 'distribution': 'uniform'}. Best is trial 1 with value: 70.70611791718673.
[I 2024-11-26 01:47:27,257] Trial 6 finished with value: 64.72077481280822 and parameters: {'radius': 0.6821219161606836, 'angle': 20.171533219750003, 'sigma': 0.023029660128909286, 'probability': 0.3445932271336794, 'scale': 1.0621651591134849, 'distribution': 'uniform'}. Best is trial 6 with value: 64.72077481280822.
[I 2024-11-26 01:47:28,445] Trial 7 finished with value: 75.0758493979666 and parameters: {'radius': 0.8140813264406845, 'angle': 24.045186412279342, 'sigma': 0.050183429490732595, 'probability': 0.7268619598428343, 'scale': 0.8044000793113505, 'distribution': 'gaussian'}. Best is trial 6 with value: 64.72077481280822.
[I 2024-11-26 01:47:29,658] Trial 8 finished with value: 84.17846427676295 and parameters: {'radius': 0.45847332480317315, 'angle': 23.191417090155063, 'sigma': 0.018605760184355342, 'probability': 0.4289610394599431, 'scale': 0.501239000195703, 'distribution': 'gaussian'}. Best is trial 6 with value: 64.72077481280822.
[I 2024-11-26 01:47:30,823] Trial 9 finished with value: 67.76632773903987 and parameters: {'radius': 0.5712133280466619, 'angle': 24.003023464583986, 'sigma': 0.22844380345100387, 'probability': 0.4723242486029732, 'scale': 1.2753628930545924, 'distribution': 'gaussian'}. Best is trial 6 with value: 64.72077481280822.
[I 2024-11-26 01:47:31,991] Trial 10 finished with value: 105.86463694813739 and parameters: {'radius': 0.8693724248900996, 'angle': 20.21519489750488, 'sigma': 0.13671933081140797, 'probability': 0.250028904083893, 'scale': 1.4137893481300408, 'distribution': 'uniform'}. Best is trial 6 with value: 64.72077481280822.
[I 2024-11-26 01:47:33,161] Trial 11 finished with value: 91.5218073139811 and parameters: {'radius': 0.7200749316052263, 'angle': 21.92460530404399, 'sigma': 0.20401937441196133, 'probability': 0.3179440577712151, 'scale': 1.4935882031558476, 'distribution': 'uniform'}. Best is trial 6 with value: 64.72077481280822.
[I 2024-11-26 01:47:34,397] Trial 12 finished with value: 72.69032314772423 and parameters: {'radius': 0.6719265176162247, 'angle': 21.702902603783276, 'sigma': 0.21475237693752092, 'probability': 0.36905119773308165, 'scale': 1.0164584224663207, 'distribution': 'gaussian'}. Best is trial 6 with value: 64.72077481280822.
[I 2024-11-26 01:47:35,620] Trial 13 finished with value: 67.95661817926994 and parameters: {'radius': 0.64972140933166, 'angle': 23.535184127532634, 'sigma': 0.14881775854075638, 'probability': 0.5249980462719519, 'scale': 1.215793358670472, 'distribution': 'uniform'}. Best is trial 6 with value: 64.72077481280822.
[I 2024-11-26 01:47:36,849] Trial 14 finished with value: 81.14602175748276 and parameters: {'radius': 0.33597209405296713, 'angle': 22.669336916083804, 'sigma': 0.22811523213813523, 'probability': 0.3936583054270072, 'scale': 1.0940901283178845, 'distribution': 'gaussian'}. Best is trial 6 with value: 64.72077481280822.
