Exit code: 0
Stdout:
Mejores hiperpar√°metros encontrados:
{'factor': 0.7325180158594513, 'self_conf': 2.5045374348029945, 'swarm_conf': 2.501375609335395, 'version': 'constriction', 'distribution': 'gaussian', 'scale': 1.0516745469727167, 'beta': 1.640437524717211}
Mejor rendimiento encontrado:
2.0348267419340065

Stderr:
[I 2025-01-16 15:42:25,853] A new study created in memory with name: no-name-3a81ee03-79e7-497c-8e9f-1e1b082cc99b
[I 2025-01-16 15:42:28,815] Trial 0 finished with value: 2.7107971788803393 and parameters: {'factor': 0.6152057582639666, 'self_conf': 2.9829093186471964, 'swarm_conf': 2.7074120243748583, 'version': 'constriction', 'distribution': 'levy', 'scale': 0.5791659265393966, 'beta': 4.079688932405086}. Best is trial 0 with value: 2.7107971788803393.
[I 2025-01-16 15:42:29,938] Trial 1 finished with value: 50.843072197124705 and parameters: {'factor': 0.7970112890718891, 'self_conf': 2.726525154771016, 'swarm_conf': 2.648209982733957, 'version': 'inertial', 'distribution': 'uniform', 'scale': 1.1916470518010156, 'beta': 4.413312741501521}. Best is trial 0 with value: 2.7107971788803393.
[I 2025-01-16 15:42:31,104] Trial 2 finished with value: 3.837670255363731 and parameters: {'factor': 0.7386575045064726, 'self_conf': 2.662880406907313, 'swarm_conf': 2.8669764241918894, 'version': 'constriction', 'distribution': 'gaussian', 'scale': 1.37249132301665, 'beta': 4.238892182637672}. Best is trial 0 with value: 2.7107971788803393.
[I 2025-01-16 15:42:32,272] Trial 3 finished with value: 4.276496546243928 and parameters: {'factor': 0.7818094901426123, 'self_conf': 2.7461563736007975, 'swarm_conf': 2.6097474356379324, 'version': 'constriction', 'distribution': 'gaussian', 'scale': 1.2843676085895752, 'beta': 4.125534919067863}. Best is trial 0 with value: 2.7107971788803393.
/Users/valeriaenriquezlimon/Documents/meta-h-generator/llm-metaheuristics/operators.py:794: RuntimeWarning: invalid value encountered in scalar power
  sigma = ((math.gamma(1 + beta) * np.sin(np.pi * beta / 2)) / (
/Users/valeriaenriquezlimon/Documents/meta-h-generator/llm-metaheuristics/operators.py:794: RuntimeWarning: invalid value encountered in scalar power
  sigma = ((math.gamma(1 + beta) * np.sin(np.pi * beta / 2)) / (
/Users/valeriaenriquezlimon/Documents/meta-h-generator/llm-metaheuristics/operators.py:794: RuntimeWarning: invalid value encountered in scalar power
  sigma = ((math.gamma(1 + beta) * np.sin(np.pi * beta / 2)) / (
/Users/valeriaenriquezlimon/Documents/meta-h-generator/llm-metaheuristics/operators.py:794: RuntimeWarning: invalid value encountered in scalar power
  sigma = ((math.gamma(1 + beta) * np.sin(np.pi * beta / 2)) / (
/Users/valeriaenriquezlimon/Documents/meta-h-generator/llm-metaheuristics/operators.py:794: RuntimeWarning: invalid value encountered in scalar power
  sigma = ((math.gamma(1 + beta) * np.sin(np.pi * beta / 2)) / (
/Users/valeriaenriquezlimon/Documents/meta-h-generator/llm-metaheuristics/operators.py:794: RuntimeWarning: invalid value encountered in scalar power
  sigma = ((math.gamma(1 + beta) * np.sin(np.pi * beta / 2)) / (
/Users/valeriaenriquezlimon/Documents/meta-h-generator/llm-metaheuristics/operators.py:794: RuntimeWarning: invalid value encountered in scalar power
  sigma = ((math.gamma(1 + beta) * np.sin(np.pi * beta / 2)) / (
/Users/valeriaenriquezlimon/Documents/meta-h-generator/llm-metaheuristics/operators.py:794: RuntimeWarning: invalid value encountered in scalar power
  sigma = ((math.gamma(1 + beta) * np.sin(np.pi * beta / 2)) / (
[I 2025-01-16 15:42:33,483] Trial 4 finished with value: 58.72166944154105 and parameters: {'factor': 0.7586741291015766, 'self_conf': 2.798822008632549, 'swarm_conf': 2.8275243840592106, 'version': 'inertial', 'distribution': 'levy', 'scale': 0.8804520985442866, 'beta': 2.689292893291092}. Best is trial 0 with value: 2.7107971788803393.
[I 2025-01-16 15:42:34,709] Trial 5 finished with value: 54.85606736094919 and parameters: {'factor': 0.6171357538900856, 'self_conf': 2.812333593314754, 'swarm_conf': 2.9105173272982703, 'version': 'inertial', 'distribution': 'levy', 'scale': 1.2251669375652008, 'beta': 2.6169278061834635}. Best is trial 0 with value: 2.7107971788803393.
[I 2025-01-16 15:42:35,862] Trial 6 finished with value: 47.66996041294948 and parameters: {'factor': 0.7822762780770673, 'self_conf': 2.9486778229438637, 'swarm_conf': 2.7347079345432377, 'version': 'inertial', 'distribution': 'uniform', 'scale': 1.3332472139360667, 'beta': 2.2405410174411395}. Best is trial 0 with value: 2.7107971788803393.
[I 2025-01-16 15:42:37,078] Trial 7 finished with value: 50.75914679484745 and parameters: {'factor': 0.6990191814409635, 'self_conf': 2.5475110664968934, 'swarm_conf': 2.9596241833935997, 'version': 'constriction', 'distribution': 'levy', 'scale': 0.8209499584225333, 'beta': 3.4641472489180685}. Best is trial 0 with value: 2.7107971788803393.
[I 2025-01-16 15:42:38,250] Trial 8 finished with value: 2.5185955943080494 and parameters: {'factor': 0.7656682180236016, 'self_conf': 2.6384550949680183, 'swarm_conf': 2.7765450841644483, 'version': 'constriction', 'distribution': 'gaussian', 'scale': 1.0364617402052865, 'beta': 2.6613839232376093}. Best is trial 8 with value: 2.5185955943080494.
[I 2025-01-16 15:42:39,459] Trial 9 finished with value: 45.96325081990669 and parameters: {'factor': 0.6778718251881267, 'self_conf': 2.8410714097878396, 'swarm_conf': 2.655393813583708, 'version': 'constriction', 'distribution': 'levy', 'scale': 0.7073100109806277, 'beta': 3.90514987470767}. Best is trial 8 with value: 2.5185955943080494.
[I 2025-01-16 15:42:40,640] Trial 10 finished with value: 2.0348267419340065 and parameters: {'factor': 0.7325180158594513, 'self_conf': 2.5045374348029945, 'swarm_conf': 2.501375609335395, 'version': 'constriction', 'distribution': 'gaussian', 'scale': 1.0516745469727167, 'beta': 1.640437524717211}. Best is trial 10 with value: 2.0348267419340065.
[I 2025-01-16 15:42:41,830] Trial 11 finished with value: 2.1732828739014636 and parameters: {'factor': 0.7308658066978245, 'self_conf': 2.517987085780038, 'swarm_conf': 2.530921374633548, 'version': 'constriction', 'distribution': 'gaussian', 'scale': 1.034968573569379, 'beta': 1.5626874004636497}. Best is trial 10 with value: 2.0348267419340065.
[I 2025-01-16 15:42:43,004] Trial 12 finished with value: 2.0709817040093785 and parameters: {'factor': 0.7228157955196374, 'self_conf': 2.50603131980888, 'swarm_conf': 2.504453502692691, 'version': 'constriction', 'distribution': 'gaussian', 'scale': 1.0544797130605288, 'beta': 1.5040454603256674}. Best is trial 10 with value: 2.0348267419340065.
[I 2025-01-16 15:42:44,194] Trial 13 finished with value: 2.1906758859636177 and parameters: {'factor': 0.6632258140885331, 'self_conf': 2.5811809057004664, 'swarm_conf': 2.5016412631761824, 'version': 'constriction', 'distribution': 'gaussian', 'scale': 1.108517424106505, 'beta': 1.6125158720235357}. Best is trial 10 with value: 2.0348267419340065.
[I 2025-01-16 15:42:45,376] Trial 14 finished with value: 2.7686804222085186 and parameters: {'factor': 0.7234434552325486, 'self_conf': 2.5052928098069733, 'swarm_conf': 2.5769811585100832, 'version': 'constriction', 'distribution': 'gaussian', 'scale': 0.8659404897354834, 'beta': 2.0552164129868205}. Best is trial 10 with value: 2.0348267419340065.
