Exit code: 0
Stdout:
Mejores hiperpar√°metros encontrados:
{'scale': 0.0013569708838820698, 'distribution': 'levy', 'gravity': 0.004203454729535828, 'alpha': 0.029044362756527588, 'beta': 1.4502915347586258, 'dt': 0.6802082736406537, 'expression': 'rand-to-best', 'num_rands': 1, 'factor': 1.1186035220316701}
Mejor rendimiento encontrado:
30.088769692451432

Stderr:
[I 2025-03-26 10:54:43,949] A new study created in memory with name: no-name-5b33b6e3-8f96-422e-a1e7-3d0c6b9e5126
/Users/valeriaenriquezlimon/Documents/meta-h-generator/llm-metaheuristics/.venv/lib/python3.12/site-packages/optuna/trial/_trial.py:678: RuntimeWarning: Inconsistent parameter values for distribution with name "gravity"! This might be a configuration mistake. Optuna allows to call the same distribution with the same name more than once in a trial. When the parameter values are inconsistent optuna only uses the values of the first call and ignores all following. Using these values: {'step': None, 'low': 0.001, 'high': 0.01, 'log': False}
  warnings.warn(
/Users/valeriaenriquezlimon/Documents/meta-h-generator/llm-metaheuristics/.venv/lib/python3.12/site-packages/optuna/trial/_trial.py:678: RuntimeWarning: Inconsistent parameter values for distribution with name "alpha"! This might be a configuration mistake. Optuna allows to call the same distribution with the same name more than once in a trial. When the parameter values are inconsistent optuna only uses the values of the first call and ignores all following. Using these values: {'step': None, 'low': 0.01, 'high': 0.03, 'log': False}
  warnings.warn(
[I 2025-03-26 10:54:49,371] Trial 0 finished with value: 30.488842514033855 and parameters: {'scale': 0.01497652018627893, 'distribution': 'uniform', 'gravity': 0.007444462853803412, 'alpha': 0.023597981794890546, 'beta': 1.3440471864547803, 'dt': 0.2268623158925422, 'expression': 'best', 'num_rands': 2, 'factor': 1.3050726175408556}. Best is trial 0 with value: 30.488842514033855.
[I 2025-03-26 10:54:54,706] Trial 1 finished with value: 30.326094154549832 and parameters: {'scale': 0.012802812271626624, 'distribution': 'gaussian', 'gravity': 0.003483930106335024, 'alpha': 0.014314508128374936, 'beta': 1.323630177039467, 'dt': 0.3466285510674323, 'expression': 'best', 'num_rands': 1, 'factor': 0.9109930435665662}. Best is trial 1 with value: 30.326094154549832.
[I 2025-03-26 10:55:00,022] Trial 2 finished with value: 30.596627141970316 and parameters: {'scale': 0.015909064932281787, 'distribution': 'uniform', 'gravity': 0.008831560948563157, 'alpha': 0.01663915956278853, 'beta': 1.4198579690745214, 'dt': 0.8556161135318631, 'expression': 'rand', 'num_rands': 1, 'factor': 1.0715368102418668}. Best is trial 1 with value: 30.326094154549832.
[I 2025-03-26 10:55:05,379] Trial 3 finished with value: 30.164369545886235 and parameters: {'scale': 0.009150485878374495, 'distribution': 'levy', 'gravity': 0.002978351264290805, 'alpha': 0.018801069085890708, 'beta': 1.330779538050231, 'dt': 0.8884629625701917, 'expression': 'best', 'num_rands': 2, 'factor': 1.1687128855951556}. Best is trial 3 with value: 30.164369545886235.
[I 2025-03-26 10:55:10,685] Trial 4 finished with value: 30.099372914861117 and parameters: {'scale': 0.00290999883569437, 'distribution': 'gaussian', 'gravity': 0.002970444985840349, 'alpha': 0.01497549097845633, 'beta': 1.2771515697683693, 'dt': 0.535805489144865, 'expression': 'current-to-best', 'num_rands': 1, 'factor': 1.1175756481854284}. Best is trial 4 with value: 30.099372914861117.
[I 2025-03-26 10:55:16,025] Trial 5 finished with value: 30.162411702297714 and parameters: {'scale': 0.008546498118994581, 'distribution': 'uniform', 'gravity': 0.0018967357242737025, 'alpha': 0.020043336491708367, 'beta': 1.241366598374842, 'dt': 0.9638128808599781, 'expression': 'rand', 'num_rands': 2, 'factor': 0.9290744859226052}. Best is trial 4 with value: 30.099372914861117.
[I 2025-03-26 10:55:21,393] Trial 6 finished with value: 30.365492186721642 and parameters: {'scale': 0.009869070075514571, 'distribution': 'uniform', 'gravity': 0.0037329962051853784, 'alpha': 0.0110318732887863, 'beta': 1.4939894878310935, 'dt': 0.38184810911505906, 'expression': 'best', 'num_rands': 3, 'factor': 1.2970599271895737}. Best is trial 4 with value: 30.099372914861117.
[I 2025-03-26 10:55:26,737] Trial 7 finished with value: 30.295746583055664 and parameters: {'scale': 0.009757226336952276, 'distribution': 'levy', 'gravity': 0.0017992186753814422, 'alpha': 0.025777165357992043, 'beta': 1.3165096612533291, 'dt': 0.17467150766699763, 'expression': 'rand', 'num_rands': 1, 'factor': 1.2343683696125693}. Best is trial 4 with value: 30.099372914861117.
[I 2025-03-26 10:55:32,098] Trial 8 finished with value: 30.26576668082498 and parameters: {'scale': 0.01233827832028241, 'distribution': 'levy', 'gravity': 0.005869997548085558, 'alpha': 0.026511758393985715, 'beta': 1.3323497589361988, 'dt': 0.7540389840725725, 'expression': 'best', 'num_rands': 2, 'factor': 1.0814622457464205}. Best is trial 4 with value: 30.099372914861117.
[I 2025-03-26 10:55:37,462] Trial 9 finished with value: 30.088769692451432 and parameters: {'scale': 0.0013569708838820698, 'distribution': 'levy', 'gravity': 0.004203454729535828, 'alpha': 0.029044362756527588, 'beta': 1.4502915347586258, 'dt': 0.6802082736406537, 'expression': 'rand-to-best', 'num_rands': 1, 'factor': 1.1186035220316701}. Best is trial 9 with value: 30.088769692451432.
