Exit code: 0
Stdout:
Mejores hiperpar√°metros encontrados:
{'scale': 0.08085684833574106, 'distribution': 'levy', 'gravity': 0.004800658816486142, 'alpha': 0.03319701283301202, 'beta': 3.6599530771554853, 'dt': 1.1617082780319843, 'expression': 'best', 'num_rands': 1, 'factor': 1.4856032920276872}
Mejor rendimiento encontrado:
79.70572353582702

Stderr:
[I 2025-01-25 14:00:10,487] A new study created in memory with name: no-name-43633a02-5a6e-40a2-96bf-04d6d4ec4bc3
/Users/valeriaenriquezlimon/Documents/meta-h-generator/llm-metaheuristics/.venv/lib/python3.12/site-packages/optuna/trial/_trial.py:678: RuntimeWarning: Inconsistent parameter values for distribution with name "gravity"! This might be a configuration mistake. Optuna allows to call the same distribution with the same name more than once in a trial. When the parameter values are inconsistent optuna only uses the values of the first call and ignores all following. Using these values: {'step': None, 'low': 0.001, 'high': 0.01, 'log': False}
  warnings.warn(
/Users/valeriaenriquezlimon/Documents/meta-h-generator/llm-metaheuristics/.venv/lib/python3.12/site-packages/optuna/trial/_trial.py:678: RuntimeWarning: Inconsistent parameter values for distribution with name "alpha"! This might be a configuration mistake. Optuna allows to call the same distribution with the same name more than once in a trial. When the parameter values are inconsistent optuna only uses the values of the first call and ignores all following. Using these values: {'step': None, 'low': 0.01, 'high': 0.1, 'log': False}
  warnings.warn(
[I 2025-01-25 14:00:20,707] Trial 0 finished with value: 79.70572353582702 and parameters: {'scale': 0.08085684833574106, 'distribution': 'levy', 'gravity': 0.004800658816486142, 'alpha': 0.03319701283301202, 'beta': 3.6599530771554853, 'dt': 1.1617082780319843, 'expression': 'best', 'num_rands': 1, 'factor': 1.4856032920276872}. Best is trial 0 with value: 79.70572353582702.
[I 2025-01-25 14:00:30,813] Trial 1 finished with value: 87.39681998556692 and parameters: {'scale': 0.058037937098627805, 'distribution': 'gaussian', 'gravity': 0.0016402618321685078, 'alpha': 0.03768633311836074, 'beta': 2.395442850971854, 'dt': 0.7752273728248587, 'expression': 'best', 'num_rands': 2, 'factor': 1.8766789640171824}. Best is trial 0 with value: 79.70572353582702.
[I 2025-01-25 14:00:40,948] Trial 2 finished with value: 89.33849233121599 and parameters: {'scale': 0.05961890633571194, 'distribution': 'gaussian', 'gravity': 0.009338106866945164, 'alpha': 0.09543344991595282, 'beta': 3.107674557099771, 'dt': 1.6171027085473886, 'expression': 'rand-to-best-and-current', 'num_rands': 1, 'factor': 1.2626489121271596}. Best is trial 0 with value: 79.70572353582702.
[I 2025-01-25 14:00:51,063] Trial 3 finished with value: 79.76673598294411 and parameters: {'scale': 0.010359950208813926, 'distribution': 'gaussian', 'gravity': 0.007349299703057694, 'alpha': 0.07802669778092795, 'beta': 2.809648990473889, 'dt': 0.906648647879293, 'expression': 'best', 'num_rands': 1, 'factor': 1.2513789053836757}. Best is trial 0 with value: 79.70572353582702.
[I 2025-01-25 14:01:01,168] Trial 4 finished with value: 92.78847287023166 and parameters: {'scale': 0.04864394133749291, 'distribution': 'uniform', 'gravity': 0.005323358329876228, 'alpha': 0.03266961397065101, 'beta': 2.4981030211922817, 'dt': 1.12109061369294, 'expression': 'current-to-best', 'num_rands': 2, 'factor': 1.3797178660459737}. Best is trial 0 with value: 79.70572353582702.
[I 2025-01-25 14:01:11,338] Trial 5 finished with value: 90.08809394091358 and parameters: {'scale': 0.060809234804913036, 'distribution': 'levy', 'gravity': 0.009134519507236104, 'alpha': 0.07212865620355784, 'beta': 2.87905625848351, 'dt': 1.5308987445427522, 'expression': 'rand-to-best-and-current', 'num_rands': 2, 'factor': 1.8670095088323424}. Best is trial 0 with value: 79.70572353582702.
[I 2025-01-25 14:01:21,464] Trial 6 finished with value: 90.57734688105839 and parameters: {'scale': 0.09091096324690352, 'distribution': 'gaussian', 'gravity': 0.0036252937992473466, 'alpha': 0.05161542900723541, 'beta': 2.9809680176680144, 'dt': 1.9318164561808282, 'expression': 'current', 'num_rands': 1, 'factor': 1.6700183195526213}. Best is trial 0 with value: 79.70572353582702.
[I 2025-01-25 14:01:31,731] Trial 7 finished with value: 91.38792468188838 and parameters: {'scale': 0.06799349581719114, 'distribution': 'levy', 'gravity': 0.007689523921084948, 'alpha': 0.010718845065919249, 'beta': 2.4216046022432263, 'dt': 1.7112385250625264, 'expression': 'rand', 'num_rands': 3, 'factor': 1.5362157412592314}. Best is trial 0 with value: 79.70572353582702.
[I 2025-01-25 14:01:41,927] Trial 8 finished with value: 86.75072705852732 and parameters: {'scale': 0.022875491764883953, 'distribution': 'uniform', 'gravity': 0.00673221202649296, 'alpha': 0.023224596801101983, 'beta': 2.9456720445098523, 'dt': 1.466211670872454, 'expression': 'rand', 'num_rands': 3, 'factor': 0.5465256324595746}. Best is trial 0 with value: 79.70572353582702.
[I 2025-01-25 14:01:52,070] Trial 9 finished with value: 95.72342163518508 and parameters: {'scale': 0.01776035682187025, 'distribution': 'uniform', 'gravity': 0.006114416381204878, 'alpha': 0.07972996482662868, 'beta': 2.5269689964163504, 'dt': 1.561661379338016, 'expression': 'current-to-best', 'num_rands': 1, 'factor': 1.9567034458605914}. Best is trial 0 with value: 79.70572353582702.
