Exit code: 0
Stdout:
Mejores hiperpar√°metros encontrados:
{'scale': 0.0033462259408240515, 'distribution': 'levy', 'gravity': 0.0034212370633280153, 'alpha': 0.04658419742366514, 'beta': 1.4095115973582926, 'dt': 1.0904660903017973, 'expression': 'rand', 'factor': 1.4323659069229464}
Mejor rendimiento encontrado:
41.712052651574965

Stderr:
[I 2025-03-05 10:32:49,504] A new study created in memory with name: no-name-2b672773-b22b-4b03-afac-c745afda2fb7
/Users/valeriaenriquezlimon/Documents/meta-h-generator/llm-metaheuristics/.venv/lib/python3.12/site-packages/optuna/trial/_trial.py:678: RuntimeWarning: Inconsistent parameter values for distribution with name "gravity"! This might be a configuration mistake. Optuna allows to call the same distribution with the same name more than once in a trial. When the parameter values are inconsistent optuna only uses the values of the first call and ignores all following. Using these values: {'step': None, 'low': 0.001, 'high': 0.01, 'log': False}
  warnings.warn(
[I 2025-03-05 10:33:02,728] Trial 0 finished with value: 41.94267144141809 and parameters: {'scale': 0.011216066543168913, 'distribution': 'gaussian', 'gravity': 0.0027811513319014472, 'alpha': 0.0335048806171491, 'beta': 1.720102695498929, 'dt': 1.0662329500335506, 'expression': 'rand', 'factor': 1.3442445152793465}. Best is trial 0 with value: 41.94267144141809.
[I 2025-03-05 10:33:15,191] Trial 1 finished with value: 42.68439664487244 and parameters: {'scale': 0.002732602279036816, 'distribution': 'levy', 'gravity': 0.007244468508464027, 'alpha': 0.014852848662945565, 'beta': 1.4122573860719054, 'dt': 1.1987388165258435, 'expression': 'best', 'factor': 1.186925733272758}. Best is trial 0 with value: 41.94267144141809.
[I 2025-03-05 10:33:27,551] Trial 2 finished with value: 41.712052651574965 and parameters: {'scale': 0.0033462259408240515, 'distribution': 'levy', 'gravity': 0.0034212370633280153, 'alpha': 0.04658419742366514, 'beta': 1.4095115973582926, 'dt': 1.0904660903017973, 'expression': 'rand', 'factor': 1.4323659069229464}. Best is trial 2 with value: 41.712052651574965.
[I 2025-03-05 10:33:39,933] Trial 3 finished with value: 44.92897468578057 and parameters: {'scale': 0.0148573676059644, 'distribution': 'uniform', 'gravity': 0.002909677021152383, 'alpha': 0.04154458247588517, 'beta': 1.096886688074382, 'dt': 1.4374243885340579, 'expression': 'rand-to-best', 'factor': 1.4787955256695713}. Best is trial 2 with value: 41.712052651574965.
[I 2025-03-05 10:33:52,625] Trial 4 finished with value: 44.40252679844712 and parameters: {'scale': 0.007965900221769481, 'distribution': 'uniform', 'gravity': 0.006062826097518136, 'alpha': 0.027939242210955534, 'beta': 1.4495808709973788, 'dt': 1.0940580887230764, 'expression': 'current-to-best', 'factor': 1.3170972417923086}. Best is trial 2 with value: 41.712052651574965.
[I 2025-03-05 10:34:05,019] Trial 5 finished with value: 41.727407554141195 and parameters: {'scale': 0.017439516067908754, 'distribution': 'uniform', 'gravity': 0.00897905499753334, 'alpha': 0.014332427080686053, 'beta': 1.7347080450029386, 'dt': 1.0710303539893893, 'expression': 'current-to-best', 'factor': 1.4472537864187511}. Best is trial 2 with value: 41.712052651574965.
[I 2025-03-05 10:34:17,548] Trial 6 finished with value: 42.8839271257474 and parameters: {'scale': 0.0013807578392372236, 'distribution': 'levy', 'gravity': 0.00386876397157734, 'alpha': 0.019265925174491043, 'beta': 1.3876156424764434, 'dt': 1.534440126211686, 'expression': 'rand-to-best-and-current', 'factor': 1.0176716301385706}. Best is trial 2 with value: 41.712052651574965.
[I 2025-03-05 10:34:30,128] Trial 7 finished with value: 47.69827626555115 and parameters: {'scale': 0.0049243348695852404, 'distribution': 'levy', 'gravity': 0.0068153014597036495, 'alpha': 0.04876701192628266, 'beta': 1.7639672841575822, 'dt': 1.8702034550521887, 'expression': 'current', 'factor': 1.9124111426354278}. Best is trial 2 with value: 41.712052651574965.
[I 2025-03-05 10:34:42,451] Trial 8 finished with value: 44.394962664761344 and parameters: {'scale': 0.017033347395816235, 'distribution': 'uniform', 'gravity': 0.005057271507838855, 'alpha': 0.045590504086708616, 'beta': 1.7606212140870472, 'dt': 1.37312385196487, 'expression': 'best', 'factor': 1.418719225107183}. Best is trial 2 with value: 41.712052651574965.
[I 2025-03-05 10:34:54,955] Trial 9 finished with value: 52.38689838495443 and parameters: {'scale': 0.010568429891886832, 'distribution': 'levy', 'gravity': 0.004870382897245512, 'alpha': 0.020008190427433827, 'beta': 1.6249217587787932, 'dt': 1.3019741189317937, 'expression': 'current', 'factor': 1.836761036736394}. Best is trial 2 with value: 41.712052651574965.
