Exit code: 0
Stdout:
Mejor resultado encontrado:
Valor objetivo: 92.94
Par√°metros utilizados: {'scale': 0.08629150767559601, 'distribution': 'uniform', 'gravity': 0.004991477823672039, 'alpha': 0.034408563790708536, 'beta': 1.3686282064020427, 'dt': 1.2671828224687756, 'expression': 'best', 'num_rands': 4, 'factor': 0.8505449153034913, 'self_conf': 2.5109810119952543, 'swarm_conf': 2.977411573231863, 'version': 'constriction'}

Stderr:
[I 2025-02-08 14:19:20,175] A new study created in memory with name: no-name-ccad3512-19c0-452a-9d8a-6f7f424db939
/Users/valeriaenriquezlimon/Documents/meta-h-generator/llm-metaheuristics/.venv/lib/python3.12/site-packages/optuna/trial/_trial.py:678: RuntimeWarning: Inconsistent parameter values for distribution with name "factor"! This might be a configuration mistake. Optuna allows to call the same distribution with the same name more than once in a trial. When the parameter values are inconsistent optuna only uses the values of the first call and ignores all following. Using these values: {'step': None, 'low': 0.8, 'high': 1.4, 'log': False}
  warnings.warn(
[I 2025-02-08 14:19:24,140] Trial 0 finished with value: 93.15889916700492 and parameters: {'scale': 0.07885751586265943, 'distribution': 'gaussian', 'gravity': 0.0012127909705309898, 'alpha': 0.03562437848855452, 'beta': 1.485684770286476, 'dt': 1.2937996046746352, 'expression': 'rand', 'num_rands': 2, 'factor': 1.221419122929446, 'self_conf': 2.667526671624128, 'swarm_conf': 2.914068044534373, 'version': 'constriction'}. Best is trial 0 with value: 93.15889916700492.
[I 2025-02-08 14:19:28,024] Trial 1 finished with value: 95.22340267275163 and parameters: {'scale': 0.337616503271871, 'distribution': 'gaussian', 'gravity': 0.00922565714664227, 'alpha': 0.0365136705847098, 'beta': 1.5699210837363102, 'dt': 1.976057934355294, 'expression': 'current-to-best', 'num_rands': 5, 'factor': 1.3159698749278794, 'self_conf': 1.917731323856869, 'swarm_conf': 2.1649228988731926, 'version': 'constriction'}. Best is trial 0 with value: 93.15889916700492.
[I 2025-02-08 14:19:32,273] Trial 2 finished with value: 92.94 and parameters: {'scale': 0.08629150767559601, 'distribution': 'uniform', 'gravity': 0.004991477823672039, 'alpha': 0.034408563790708536, 'beta': 1.3686282064020427, 'dt': 1.2671828224687756, 'expression': 'best', 'num_rands': 4, 'factor': 0.8505449153034913, 'self_conf': 2.5109810119952543, 'swarm_conf': 2.977411573231863, 'version': 'constriction'}. Best is trial 2 with value: 92.94.
[I 2025-02-08 14:19:36,088] Trial 3 finished with value: 95.28093683665425 and parameters: {'scale': 0.02550496971438655, 'distribution': 'gaussian', 'gravity': 0.001978162284348044, 'alpha': 0.015746437965267847, 'beta': 1.8376381744162846, 'dt': 1.3244680329103509, 'expression': 'rand', 'num_rands': 4, 'factor': 1.308578683062224, 'self_conf': 2.119861984757504, 'swarm_conf': 1.570959499256162, 'version': 'constriction'}. Best is trial 2 with value: 92.94.
[I 2025-02-08 14:19:40,336] Trial 4 finished with value: 93.4258572683342 and parameters: {'scale': 0.20438853168025634, 'distribution': 'uniform', 'gravity': 0.00995765789994459, 'alpha': 0.01618928760836253, 'beta': 1.0212317769149286, 'dt': 1.7652210753821698, 'expression': 'rand-to-best', 'num_rands': 2, 'factor': 1.3832437954333787, 'self_conf': 2.497532601765659, 'swarm_conf': 1.8030303146523294, 'version': 'inertial'}. Best is trial 2 with value: 92.94.
[I 2025-02-08 14:19:44,469] Trial 5 finished with value: 92.94 and parameters: {'scale': 0.35342159376320786, 'distribution': 'uniform', 'gravity': 0.008582215963322736, 'alpha': 0.0454224182453702, 'beta': 1.5668915858459036, 'dt': 1.0636182531303997, 'expression': 'current-to-best', 'num_rands': 1, 'factor': 1.0971374852635398, 'self_conf': 1.9099110124752923, 'swarm_conf': 2.2815697631784215, 'version': 'constriction'}. Best is trial 2 with value: 92.94.
[I 2025-02-08 14:19:48,321] Trial 6 finished with value: 93.60487253321119 and parameters: {'scale': 0.4432894201373591, 'distribution': 'gaussian', 'gravity': 0.0026071291050010614, 'alpha': 0.03730014711556628, 'beta': 1.8400361964096823, 'dt': 1.2046963754365732, 'expression': 'rand-to-best', 'num_rands': 1, 'factor': 0.9749318479026048, 'self_conf': 1.6072587948769845, 'swarm_conf': 2.6855985485582474, 'version': 'inertial'}. Best is trial 2 with value: 92.94.
[I 2025-02-08 14:19:52,254] Trial 7 finished with value: 93.37990911951135 and parameters: {'scale': 0.3888749558804278, 'distribution': 'gaussian', 'gravity': 0.00876347169290017, 'alpha': 0.020542087881504918, 'beta': 1.1049336414479525, 'dt': 1.9508754393807828, 'expression': 'rand-to-best', 'num_rands': 3, 'factor': 1.190286414749443, 'self_conf': 2.833075256414576, 'swarm_conf': 1.8395035189346978, 'version': 'constriction'}. Best is trial 2 with value: 92.94.
[I 2025-02-08 14:19:56,319] Trial 8 finished with value: 93.18792407829531 and parameters: {'scale': 0.07291589728755732, 'distribution': 'uniform', 'gravity': 0.004247263731189247, 'alpha': 0.03769309933489264, 'beta': 1.2337817870038008, 'dt': 1.2169212786876915, 'expression': 'best', 'num_rands': 2, 'factor': 1.1071511859059044, 'self_conf': 1.7791584051539329, 'swarm_conf': 2.918212351701661, 'version': 'inertial'}. Best is trial 2 with value: 92.94.
[I 2025-02-08 14:20:00,480] Trial 9 finished with value: 93.73803216084313 and parameters: {'scale': 0.2377808604454582, 'distribution': 'uniform', 'gravity': 0.0037782360753341343, 'alpha': 0.03818195466798063, 'beta': 1.1435591059985044, 'dt': 1.9483770676218541, 'expression': 'rand', 'num_rands': 1, 'factor': 1.2050824665381445, 'self_conf': 2.1663938783135457, 'swarm_conf': 2.3311859517082842, 'version': 'inertial'}. Best is trial 2 with value: 92.94.
[I 2025-02-08 14:20:05,318] Trial 10 finished with value: 92.94 and parameters: {'scale': 0.16769746186409806, 'distribution': 'uniform', 'gravity': 0.006378665768129679, 'alpha': 0.02576502947863758, 'beta': 1.3601870922930974, 'dt': 1.5479155244730771, 'expression': 'best', 'num_rands': 5, 'factor': 0.8062735457879399, 'self_conf': 2.451218780973374, 'swarm_conf': 2.6269013654204403, 'version': 'constriction'}. Best is trial 2 with value: 92.94.
[I 2025-02-08 14:20:09,617] Trial 11 finished with value: 92.94 and parameters: {'scale': 0.3072545916613194, 'distribution': 'uniform', 'gravity': 0.0069553727439819624, 'alpha': 0.047817771670727344, 'beta': 1.6305060188661575, 'dt': 1.01103288227011, 'expression': 'current', 'num_rands': 4, 'factor': 0.9155436382985731, 'self_conf': 2.971194235929768, 'swarm_conf': 2.311151385819039, 'version': 'constriction'}. Best is trial 2 with value: 92.94.
[I 2025-02-08 14:20:13,904] Trial 12 finished with value: 92.94 and parameters: {'scale': 0.49655748988159354, 'distribution': 'uniform', 'gravity': 0.007590633483623807, 'alpha': 0.048066136567460185, 'beta': 1.381654115590119, 'dt': 1.0012036424384048, 'expression': 'current-to-best', 'num_rands': 4, 'factor': 1.0015002886410895, 'self_conf': 1.9513128791516345, 'swarm_conf': 2.6109954486013924, 'version': 'constriction'}. Best is trial 2 with value: 92.94.
[I 2025-02-08 14:20:18,052] Trial 13 finished with value: 92.94 and parameters: {'scale': 0.13081020407090116, 'distribution': 'uniform', 'gravity': 0.005182784444355197, 'alpha': 0.0433804637461379, 'beta': 1.5861252380013715, 'dt': 1.47949467150071, 'expression': 'current-to-best', 'num_rands': 3, 'factor': 0.8081202392859907, 'self_conf': 2.3676334564517574, 'swarm_conf': 1.9890939135489414, 'version': 'constriction'}. Best is trial 2 with value: 92.94.
[I 2025-02-08 14:20:22,062] Trial 14 finished with value: 93.04465316128444 and parameters: {'scale': 0.28504957560489413, 'distribution': 'uniform', 'gravity': 0.0054599215737720745, 'alpha': 0.02906769751837534, 'beta': 1.7488123485847769, 'dt': 1.1392737047559045, 'expression': 'best', 'num_rands': 4, 'factor': 1.073053616813038, 'self_conf': 1.588039915934917, 'swarm_conf': 2.465388072010354, 'version': 'constriction'}. Best is trial 2 with value: 92.94.
[I 2025-02-08 14:20:26,385] Trial 15 finished with value: 92.94 and parameters: {'scale': 0.37121422634350565, 'distribution': 'uniform', 'gravity': 0.008095595739036005, 'alpha': 0.04266226020096445, 'beta': 1.9639488133095657, 'dt': 1.4056615781326767, 'expression': 'current', 'num_rands': 1, 'factor': 0.8969682175881426, 'self_conf': 2.2461792520009243, 'swarm_conf': 2.973840818140568, 'version': 'constriction'}. Best is trial 2 with value: 92.94.
[I 2025-02-08 14:20:30,449] Trial 16 finished with value: 92.94 and parameters: {'scale': 0.2337676698718441, 'distribution': 'uniform', 'gravity': 0.004012310443484594, 'alpha': 0.031850162815789576, 'beta': 1.3895793306628563, 'dt': 1.6345215542395826, 'expression': 'current-to-best', 'num_rands': 3, 'factor': 1.085920752106519, 'self_conf': 2.650354922151838, 'swarm_conf': 2.0906395115549845, 'version': 'constriction'}. Best is trial 2 with value: 92.94.
[I 2025-02-08 14:20:34,582] Trial 17 finished with value: 92.94 and parameters: {'scale': 0.011932198013708262, 'distribution': 'uniform', 'gravity': 0.006154588476213008, 'alpha': 0.024074008126934526, 'beta': 1.2625356942551789, 'dt': 1.1358639526038594, 'expression': 'best', 'num_rands': 2, 'factor': 0.8992470433010611, 'self_conf': 1.9434073257356088, 'swarm_conf': 2.7767335463390084, 'version': 'constriction'}. Best is trial 2 with value: 92.94.
[I 2025-02-08 14:20:38,461] Trial 18 finished with value: 93.41927104866441 and parameters: {'scale': 0.41681528580034766, 'distribution': 'uniform', 'gravity': 0.0046066224730211365, 'alpha': 0.011008828458271325, 'beta': 1.475817654202499, 'dt': 1.114124091507856, 'expression': 'best', 'num_rands': 3, 'factor': 1.0140020187512346, 'self_conf': 1.7450849281190637, 'swarm_conf': 2.4797566032016602, 'version': 'inertial'}. Best is trial 2 with value: 92.94.
[I 2025-02-08 14:20:42,463] Trial 19 finished with value: 93.31986427553268 and parameters: {'scale': 0.12007896560120417, 'distribution': 'uniform', 'gravity': 0.003088738605364766, 'alpha': 0.0433670907976561, 'beta': 1.6629247069889752, 'dt': 1.3368727254096955, 'expression': 'current-to-best', 'num_rands': 5, 'factor': 1.1474150716234273, 'self_conf': 2.0982105477699466, 'swarm_conf': 1.5053599866163023, 'version': 'constriction'}. Best is trial 2 with value: 92.94.
[I 2025-02-08 14:20:46,767] Trial 20 finished with value: 92.94 and parameters: {'scale': 0.3297218848637491, 'distribution': 'uniform', 'gravity': 0.007341338472303753, 'alpha': 0.04998337288065323, 'beta': 1.2790848484929969, 'dt': 1.2358314787498073, 'expression': 'current', 'num_rands': 4, 'factor': 0.9478231683892638, 'self_conf': 2.3807260279613933, 'swarm_conf': 2.442486446840088, 'version': 'constriction'}. Best is trial 2 with value: 92.94.
[I 2025-02-08 14:20:51,046] Trial 21 finished with value: 92.94 and parameters: {'scale': 0.17067671717805522, 'distribution': 'uniform', 'gravity': 0.006065421469487442, 'alpha': 0.028526282193365945, 'beta': 1.3710252620647305, 'dt': 1.6017193438514925, 'expression': 'best', 'num_rands': 5, 'factor': 0.8048855553470948, 'self_conf': 2.577398738401893, 'swarm_conf': 2.722845080337982, 'version': 'constriction'}. Best is trial 2 with value: 92.94.
[I 2025-02-08 14:20:55,368] Trial 22 finished with value: 92.94 and parameters: {'scale': 0.17751372507668384, 'distribution': 'uniform', 'gravity': 0.006311984956249263, 'alpha': 0.02534320336376985, 'beta': 1.4668815759088385, 'dt': 1.6039808907339836, 'expression': 'best', 'num_rands': 5, 'factor': 0.8684046619317576, 'self_conf': 2.364206753333801, 'swarm_conf': 2.5831945046578886, 'version': 'constriction'}. Best is trial 2 with value: 92.94.
[I 2025-02-08 14:20:59,539] Trial 23 finished with value: 92.94 and parameters: {'scale': 0.12961478384042438, 'distribution': 'uniform', 'gravity': 0.008685602726159522, 'alpha': 0.033462150082011574, 'beta': 1.3358547656578132, 'dt': 1.4650901803892902, 'expression': 'best', 'num_rands': 5, 'factor': 0.8475040103196549, 'self_conf': 2.7413345156337954, 'swarm_conf': 2.7905918695669634, 'version': 'constriction'}. Best is trial 2 with value: 92.94.
[I 2025-02-08 14:21:03,848] Trial 24 finished with value: 92.94 and parameters: {'scale': 0.07587272664227791, 'distribution': 'uniform', 'gravity': 0.006847354748297626, 'alpha': 0.02461922997706212, 'beta': 1.1996833971046466, 'dt': 1.6906542072219886, 'expression': 'best', 'num_rands': 4, 'factor': 0.8455382810443715, 'self_conf': 2.398319908541761, 'swarm_conf': 2.2440804927363107, 'version': 'constriction'}. Best is trial 2 with value: 92.94.
[I 2025-02-08 14:21:08,210] Trial 25 finished with value: 92.94 and parameters: {'scale': 0.2688631272812243, 'distribution': 'uniform', 'gravity': 0.004863924296575761, 'alpha': 0.021532360074589398, 'beta': 1.5402687663611512, 'dt': 1.4033714661334897, 'expression': 'current-to-best', 'num_rands': 5, 'factor': 1.0457594526333975, 'self_conf': 2.5189882070204024, 'swarm_conf': 2.8091131699733394, 'version': 'constriction'}. Best is trial 2 with value: 92.94.
[I 2025-02-08 14:21:12,103] Trial 26 finished with value: 93.71187425069174 and parameters: {'scale': 0.19170108467887853, 'distribution': 'gaussian', 'gravity': 0.00788781632068631, 'alpha': 0.04167921209799441, 'beta': 1.4437465768339295, 'dt': 1.8093969204005886, 'expression': 'best', 'num_rands': 3, 'factor': 0.9490419955040797, 'self_conf': 2.2444122220702147, 'swarm_conf': 2.547472822937178, 'version': 'inertial'}. Best is trial 2 with value: 92.94.
[I 2025-02-08 14:21:16,383] Trial 27 finished with value: 92.94 and parameters: {'scale': 0.14580063385236955, 'distribution': 'uniform', 'gravity': 0.005834239601414368, 'alpha': 0.030948749462239154, 'beta': 1.7020297714429662, 'dt': 1.5433331482041681, 'expression': 'best', 'num_rands': 4, 'factor': 0.8004235498987213, 'self_conf': 2.0001745349818276, 'swarm_conf': 2.375381910386306, 'version': 'constriction'}. Best is trial 2 with value: 92.94.
[I 2025-02-08 14:21:20,745] Trial 28 finished with value: 92.94 and parameters: {'scale': 0.09194926039546322, 'distribution': 'uniform', 'gravity': 0.006830436608471245, 'alpha': 0.02788211506988563, 'beta': 1.3107582648607798, 'dt': 1.0519525872136315, 'expression': 'current-to-best', 'num_rands': 5, 'factor': 1.1349134345839378, 'self_conf': 1.8140701054624988, 'swarm_conf': 2.8537838637076254, 'version': 'constriction'}. Best is trial 2 with value: 92.94.
[I 2025-02-08 14:21:24,612] Trial 29 finished with value: 93.0020135281727 and parameters: {'scale': 0.04392459047155741, 'distribution': 'gaussian', 'gravity': 0.009844731935265274, 'alpha': 0.033227321001968305, 'beta': 1.5109300792907323, 'dt': 1.2621389774518725, 'expression': 'rand', 'num_rands': 1, 'factor': 1.264236205214411, 'self_conf': 2.846818177698045, 'swarm_conf': 2.646159567254434, 'version': 'constriction'}. Best is trial 2 with value: 92.94.
