Exit code: 0
Stdout:
Mejores hiperpar√°metros encontrados:
{'gravity': 0.04539270916369119, 'alpha': 0.18735709996894684, 'beta': 1.631189347211544, 'dt': 0.5819392749743161, 'pairing': 'cost', 'crossover': 'single', 'mating_pool_factor': 0.37343857464615005, 'radius': 0.7625111795012253, 'angle': 19.616089935025208, 'sigma': 0.129813164235672, 'scale': 0.8384424499941182, 'distribution': 'levy'}
Mejor rendimiento encontrado:
-546.2039041634639

Stderr:
[I 2025-03-05 13:24:34,416] A new study created in memory with name: no-name-1e859a81-5f4d-4469-98cb-bd7fe3da12e1
/Users/valeriaenriquezlimon/Documents/meta-h-generator/llm-metaheuristics/.venv/lib/python3.12/site-packages/optuna/trial/_trial.py:678: RuntimeWarning: Inconsistent parameter values for distribution with name "beta"! This might be a configuration mistake. Optuna allows to call the same distribution with the same name more than once in a trial. When the parameter values are inconsistent optuna only uses the values of the first call and ignores all following. Using these values: {'step': None, 'low': 1.5, 'high': 3.0, 'log': False}
  warnings.warn(
[I 2025-03-05 13:24:39,458] Trial 0 finished with value: -545.8091097147492 and parameters: {'gravity': 0.04393872126040172, 'alpha': 0.07205286971948079, 'beta': 1.8289362543197956, 'dt': 1.918114567884726, 'pairing': 'cost', 'crossover': 'uniform', 'mating_pool_factor': 0.4738438964257374, 'radius': 0.7778629307534121, 'angle': 22.237921799656196, 'sigma': 0.05010851198671776, 'scale': 1.5920872567381428, 'distribution': 'levy'}. Best is trial 0 with value: -545.8091097147492.
[I 2025-03-05 13:24:44,437] Trial 1 finished with value: -545.4842460194699 and parameters: {'gravity': 0.03537516731566957, 'alpha': 0.158156730431441, 'beta': 1.9766560405029379, 'dt': 0.7087495590320023, 'pairing': 'rank', 'crossover': 'uniform', 'mating_pool_factor': 0.38955635886087925, 'radius': 0.7245650760825882, 'angle': 17.10155003820907, 'sigma': 0.12975353381656995, 'scale': 1.158214107884071, 'distribution': 'uniform'}. Best is trial 0 with value: -545.8091097147492.
[I 2025-03-05 13:24:49,515] Trial 2 finished with value: -545.8061789334928 and parameters: {'gravity': 0.015525028721512086, 'alpha': 0.18234346016228334, 'beta': 1.6250968347656372, 'dt': 1.5362591398893108, 'pairing': 'random', 'crossover': 'single', 'mating_pool_factor': 0.46357059707608766, 'radius': 0.8881590447061669, 'angle': 20.566848960545432, 'sigma': 0.14574238280885, 'scale': 0.6926009037034453, 'distribution': 'uniform'}. Best is trial 0 with value: -545.8091097147492.
[I 2025-03-05 13:24:54,402] Trial 3 finished with value: -545.7762011020315 and parameters: {'gravity': 0.02807276499933883, 'alpha': 0.15297443707883035, 'beta': 2.1261538889495477, 'dt': 0.8964928360141391, 'pairing': 'rank', 'crossover': 'uniform', 'mating_pool_factor': 0.5958128883265739, 'radius': 0.7424434756457088, 'angle': 16.2875696619612, 'sigma': 0.10179642563940566, 'scale': 1.4872480153299557, 'distribution': 'gaussian'}. Best is trial 0 with value: -545.8091097147492.
[I 2025-03-05 13:24:59,362] Trial 4 finished with value: -544.9207678190287 and parameters: {'gravity': 0.009523226066148971, 'alpha': 0.18761256967127016, 'beta': 1.8342966509840681, 'dt': 1.8215504498926667, 'pairing': 'rank', 'crossover': 'single', 'mating_pool_factor': 0.38323393519950255, 'radius': 0.735255873173246, 'angle': 22.247945408063792, 'sigma': 0.05175357882498736, 'scale': 0.9782929694946076, 'distribution': 'levy'}. Best is trial 0 with value: -545.8091097147492.
[I 2025-03-05 13:25:04,308] Trial 5 finished with value: -545.7104111025703 and parameters: {'gravity': 0.0423200965790194, 'alpha': 0.17533548033280802, 'beta': 2.3688194089370063, 'dt': 0.6029759400710452, 'pairing': 'rank', 'crossover': 'two', 'mating_pool_factor': 0.2898501496663079, 'radius': 0.8449009503656826, 'angle': 15.86852410861203, 'sigma': 0.14247274674227667, 'scale': 1.6300236850085903, 'distribution': 'gaussian'}. Best is trial 0 with value: -545.8091097147492.
[I 2025-03-05 13:25:09,272] Trial 6 finished with value: -544.9701443181741 and parameters: {'gravity': 0.01247312248333424, 'alpha': 0.015593264764554002, 'beta': 2.517945364752496, 'dt': 0.636797398420651, 'pairing': 'cost', 'crossover': 'two', 'mating_pool_factor': 0.4433525416511509, 'radius': 0.8440117262258152, 'angle': 21.354891966439048, 'sigma': 0.1446570553454939, 'scale': 1.1213729584192007, 'distribution': 'gaussian'}. Best is trial 0 with value: -545.8091097147492.
/Users/valeriaenriquezlimon/Documents/meta-h-generator/llm-metaheuristics/operators.py:794: RuntimeWarning: invalid value encountered in scalar power
  sigma = ((math.gamma(1 + beta) * np.sin(np.pi * beta / 2)) / (
[I 2025-03-05 13:25:14,275] Trial 7 finished with value: -545.5036004878659 and parameters: {'gravity': 0.04580516551830871, 'alpha': 0.08474141842932995, 'beta': 2.937749447155882, 'dt': 1.4938575040563535, 'pairing': 'random', 'crossover': 'two', 'mating_pool_factor': 0.5714116161831747, 'radius': 0.7556241568676904, 'angle': 21.350666646726538, 'sigma': 0.09566456745847707, 'scale': 0.6409983667348298, 'distribution': 'levy'}. Best is trial 0 with value: -545.8091097147492.
[I 2025-03-05 13:25:19,524] Trial 8 finished with value: -546.2039041634639 and parameters: {'gravity': 0.04539270916369119, 'alpha': 0.18735709996894684, 'beta': 1.631189347211544, 'dt': 0.5819392749743161, 'pairing': 'cost', 'crossover': 'single', 'mating_pool_factor': 0.37343857464615005, 'radius': 0.7625111795012253, 'angle': 19.616089935025208, 'sigma': 0.129813164235672, 'scale': 0.8384424499941182, 'distribution': 'levy'}. Best is trial 8 with value: -546.2039041634639.
[I 2025-03-05 13:25:24,455] Trial 9 finished with value: -546.1631075755357 and parameters: {'gravity': 0.020502646737299263, 'alpha': 0.18280671074283095, 'beta': 2.637232167380999, 'dt': 1.878220411153497, 'pairing': 'rank', 'crossover': 'uniform', 'mating_pool_factor': 0.2537889133325277, 'radius': 0.7492105670952524, 'angle': 22.50446022579061, 'sigma': 0.12647822428753258, 'scale': 1.45818432889202, 'distribution': 'uniform'}. Best is trial 8 with value: -546.2039041634639.
