Exit code: 0
Stdout:
Mejores hiperpar√°metros encontrados:
{'scale': 0.18665522501870363, 'distribution': 'uniform', 'gravity': 0.06924219981917513, 'alpha': 0.17789401644297334, 'beta': 1.520287223213643, 'dt': 0.8521302565653665, 'radius': 0.7960064916966058, 'angle': 22.681602759371827, 'sigma': 0.08439621460848687}
Mejor rendimiento encontrado:
-442.3151781575119

Stderr:
[I 2025-01-23 15:49:56,973] A new study created in memory with name: no-name-fff6050d-7be4-4f73-bbbb-5ef20fc2ca2a
/Users/valeriaenriquezlimon/Documents/meta-h-generator/llm-metaheuristics/.venv/lib/python3.12/site-packages/optuna/trial/_trial.py:678: RuntimeWarning: Inconsistent parameter values for distribution with name "scale"! This might be a configuration mistake. Optuna allows to call the same distribution with the same name more than once in a trial. When the parameter values are inconsistent optuna only uses the values of the first call and ignores all following. Using these values: {'step': None, 'low': 0.01, 'high': 0.2, 'log': False}
  warnings.warn(
/Users/valeriaenriquezlimon/Documents/meta-h-generator/llm-metaheuristics/.venv/lib/python3.12/site-packages/optuna/trial/_trial.py:678: RuntimeWarning: Inconsistent parameter values for distribution with name "beta"! This might be a configuration mistake. Optuna allows to call the same distribution with the same name more than once in a trial. When the parameter values are inconsistent optuna only uses the values of the first call and ignores all following. Using these values: {'step': None, 'low': 1.5, 'high': 2.5, 'log': False}
  warnings.warn(
[I 2025-01-23 15:50:05,518] Trial 0 finished with value: -441.66172571870976 and parameters: {'scale': 0.02959011398380034, 'distribution': 'gaussian', 'gravity': 0.054144823137756086, 'alpha': 0.18009595605194773, 'beta': 1.5916748888780479, 'dt': 0.7699665197128024, 'radius': 0.8012227983405884, 'angle': 20.123026305897902, 'sigma': 0.07178759376096402}. Best is trial 0 with value: -441.66172571870976.
[I 2025-01-23 15:50:14,140] Trial 1 finished with value: -441.23494377670926 and parameters: {'scale': 0.11738688015743683, 'distribution': 'uniform', 'gravity': 0.048668585191906, 'alpha': 0.16604423384815772, 'beta': 1.7761556360006954, 'dt': 0.822277760627562, 'radius': 0.7671049438305205, 'angle': 24.67636252411546, 'sigma': 0.09144201371154224}. Best is trial 0 with value: -441.66172571870976.
[I 2025-01-23 15:50:22,770] Trial 2 finished with value: -441.02948209189407 and parameters: {'scale': 0.023306774755981908, 'distribution': 'levy', 'gravity': 0.05834171337660882, 'alpha': 0.15795236414611316, 'beta': 1.8579426990125238, 'dt': 0.8843155415221974, 'radius': 0.8577448695374967, 'angle': 21.114275204109738, 'sigma': 0.09035733646222431}. Best is trial 0 with value: -441.66172571870976.
[I 2025-01-23 15:50:31,305] Trial 3 finished with value: -440.9050402603782 and parameters: {'scale': 0.126396121488047, 'distribution': 'uniform', 'gravity': 0.04931582583369202, 'alpha': 0.1732821744468006, 'beta': 2.4023375156002063, 'dt': 0.756453357134024, 'radius': 0.8836984210987213, 'angle': 21.328852526276243, 'sigma': 0.08759521598314368}. Best is trial 0 with value: -441.66172571870976.
/Users/valeriaenriquezlimon/Documents/meta-h-generator/llm-metaheuristics/operators.py:794: RuntimeWarning: invalid value encountered in scalar power
  sigma = ((math.gamma(1 + beta) * np.sin(np.pi * beta / 2)) / (
[I 2025-01-23 15:50:39,919] Trial 4 finished with value: -437.1134106515064 and parameters: {'scale': 0.09152946960012309, 'distribution': 'levy', 'gravity': 0.08290740703496041, 'alpha': 0.1837117524203622, 'beta': 2.49700764554904, 'dt': 0.7729189652207598, 'radius': 0.8113894350120415, 'angle': 21.128809014830075, 'sigma': 0.0741840735427363}. Best is trial 0 with value: -441.66172571870976.
[I 2025-01-23 15:50:48,491] Trial 5 finished with value: -438.72739787694036 and parameters: {'scale': 0.18924617518151757, 'distribution': 'gaussian', 'gravity': 0.07504873492207555, 'alpha': 0.15688005476100772, 'beta': 2.3715332718330813, 'dt': 0.833547900958754, 'radius': 0.891174889154122, 'angle': 21.79171510894942, 'sigma': 0.07451486133208637}. Best is trial 0 with value: -441.66172571870976.
[I 2025-01-23 15:50:57,137] Trial 6 finished with value: -442.3151781575119 and parameters: {'scale': 0.18665522501870363, 'distribution': 'uniform', 'gravity': 0.06924219981917513, 'alpha': 0.17789401644297334, 'beta': 1.520287223213643, 'dt': 0.8521302565653665, 'radius': 0.7960064916966058, 'angle': 22.681602759371827, 'sigma': 0.08439621460848687}. Best is trial 6 with value: -442.3151781575119.
[I 2025-01-23 15:51:05,671] Trial 7 finished with value: -440.8388912969482 and parameters: {'scale': 0.13449496826914897, 'distribution': 'uniform', 'gravity': 0.05189618551623744, 'alpha': 0.19626160516048133, 'beta': 1.8707552631156483, 'dt': 0.7749973804265722, 'radius': 0.8658640414363141, 'angle': 22.459406436222732, 'sigma': 0.09820133170843037}. Best is trial 6 with value: -442.3151781575119.
[I 2025-01-23 15:51:14,157] Trial 8 finished with value: -436.5726407113807 and parameters: {'scale': 0.05417612152841444, 'distribution': 'gaussian', 'gravity': 0.04388673743526244, 'alpha': 0.16029694926935553, 'beta': 2.3632514408734284, 'dt': 0.7903536255119729, 'radius': 0.8911189810792786, 'angle': 23.526885583252398, 'sigma': 0.06934610135244774}. Best is trial 6 with value: -442.3151781575119.
[I 2025-01-23 15:51:22,752] Trial 9 finished with value: -438.609016426239 and parameters: {'scale': 0.10704825746886479, 'distribution': 'uniform', 'gravity': 0.08321275770863172, 'alpha': 0.15547099998612052, 'beta': 2.3391723110545923, 'dt': 0.8930678196785349, 'radius': 0.8444033278032284, 'angle': 20.668835615131037, 'sigma': 0.0639609921373783}. Best is trial 6 with value: -442.3151781575119.
