Exit code: 0
Stdout:
Mejores hiperpar√°metros encontrados:
{'scale': 0.018490815491456557, 'distribution': 'uniform', 'gravity': 0.006177654912975475, 'alpha': 0.02995664071381697, 'beta': 1.5370788327384435, 'probability': 0.8470528817405123, 'num_of_agents': 49}
Mejor rendimiento encontrado:
6.584873342878474

Stderr:
[I 2025-01-10 18:09:49,831] A new study created in memory with name: no-name-e6cee332-8d36-4bee-8bec-ae3f31e59932
/Users/valeriaenriquezlimon/Documents/meta-h-generator/llm-metaheuristics/.venv/lib/python3.12/site-packages/optuna/trial/_trial.py:678: RuntimeWarning: Inconsistent parameter values for distribution with name "scale"! This might be a configuration mistake. Optuna allows to call the same distribution with the same name more than once in a trial. When the parameter values are inconsistent optuna only uses the values of the first call and ignores all following. Using these values: {'step': None, 'low': 0.01, 'high': 0.2, 'log': False}
  warnings.warn(
[I 2025-01-10 18:09:52,914] Trial 0 finished with value: 122.79699990595735 and parameters: {'scale': 0.1218218063289214, 'distribution': 'levy', 'gravity': 0.007052542545252248, 'alpha': 0.024818728681126227, 'beta': 3.843868939022701, 'probability': 0.8720354569000417, 'num_of_agents': 42}. Best is trial 0 with value: 122.79699990595735.
[I 2025-01-10 18:09:53,666] Trial 1 finished with value: 82.08928894491407 and parameters: {'scale': 0.043146768512576886, 'distribution': 'levy', 'gravity': 0.00891386796258727, 'alpha': 0.022222240002553434, 'beta': 1.8375438352167726, 'probability': 0.8954584782987077, 'num_of_agents': 22}. Best is trial 1 with value: 82.08928894491407.
[I 2025-01-10 18:09:55,037] Trial 2 finished with value: 71.48969171515463 and parameters: {'scale': 0.17260271158846285, 'distribution': 'gaussian', 'gravity': 0.008919762357897255, 'alpha': 0.02585576246627153, 'beta': 2.661577679592282, 'probability': 0.8943961939451337, 'num_of_agents': 44}. Best is trial 2 with value: 71.48969171515463.
[I 2025-01-10 18:09:56,341] Trial 3 finished with value: 45.787046807275566 and parameters: {'scale': 0.11723289084759447, 'distribution': 'uniform', 'gravity': 0.009997291794941627, 'alpha': 0.025792317878186883, 'beta': 2.687473678760734, 'probability': 0.8175132881034468, 'num_of_agents': 42}. Best is trial 3 with value: 45.787046807275566.
[I 2025-01-10 18:09:57,200] Trial 4 finished with value: 130.14463656139776 and parameters: {'scale': 0.11063262446075282, 'distribution': 'gaussian', 'gravity': 0.008703808959747582, 'alpha': 0.02189703918987068, 'beta': 4.159016136956251, 'probability': 0.8104490917622645, 'num_of_agents': 26}. Best is trial 3 with value: 45.787046807275566.
[I 2025-01-10 18:09:57,949] Trial 5 finished with value: 105.53972564341383 and parameters: {'scale': 0.1709329658874651, 'distribution': 'gaussian', 'gravity': 0.00787850403591574, 'alpha': 0.024524774029109974, 'beta': 2.380110753059112, 'probability': 0.8981006990069588, 'num_of_agents': 22}. Best is trial 3 with value: 45.787046807275566.
[I 2025-01-10 18:09:58,671] Trial 6 finished with value: 131.30423882261834 and parameters: {'scale': 0.16583145706258928, 'distribution': 'uniform', 'gravity': 0.005124046662106486, 'alpha': 0.02168891549224919, 'beta': 3.9611951222537733, 'probability': 0.8149598603771364, 'num_of_agents': 21}. Best is trial 3 with value: 45.787046807275566.
[I 2025-01-10 18:09:59,849] Trial 7 finished with value: 24.489074374538966 and parameters: {'scale': 0.06039816575656036, 'distribution': 'uniform', 'gravity': 0.009971822755359159, 'alpha': 0.02095842153830467, 'beta': 2.3447535154199, 'probability': 0.8700900041700037, 'num_of_agents': 37}. Best is trial 7 with value: 24.489074374538966.
[I 2025-01-10 18:10:00,705] Trial 8 finished with value: 116.1496768151233 and parameters: {'scale': 0.1412658602584534, 'distribution': 'gaussian', 'gravity': 0.007724399209230182, 'alpha': 0.023112409865605078, 'beta': 2.940810132150204, 'probability': 0.8373254507914212, 'num_of_agents': 26}. Best is trial 7 with value: 24.489074374538966.
[I 2025-01-10 18:10:01,731] Trial 9 finished with value: 104.44921500000146 and parameters: {'scale': 0.08725536849587395, 'distribution': 'levy', 'gravity': 0.007382462750235983, 'alpha': 0.024309460197052983, 'beta': 2.4328573575495502, 'probability': 0.8202714122129361, 'num_of_agents': 31}. Best is trial 7 with value: 24.489074374538966.
[I 2025-01-10 18:10:03,272] Trial 10 finished with value: 7.80221183162508 and parameters: {'scale': 0.019840378397380662, 'distribution': 'uniform', 'gravity': 0.005643393979548173, 'alpha': 0.02933146058072373, 'beta': 1.6204919799199766, 'probability': 0.8638178344844354, 'num_of_agents': 49}. Best is trial 10 with value: 7.80221183162508.
[I 2025-01-10 18:10:04,853] Trial 11 finished with value: 6.785445509185266 and parameters: {'scale': 0.011095437560844633, 'distribution': 'uniform', 'gravity': 0.00552044791627621, 'alpha': 0.029608222934328694, 'beta': 1.555402074868947, 'probability': 0.8622565013060587, 'num_of_agents': 50}. Best is trial 11 with value: 6.785445509185266.
[I 2025-01-10 18:10:06,426] Trial 12 finished with value: 7.653698509434868 and parameters: {'scale': 0.015349045286833972, 'distribution': 'uniform', 'gravity': 0.0054374167717856055, 'alpha': 0.029883565722564894, 'beta': 1.5395140321437146, 'probability': 0.8547617220590065, 'num_of_agents': 50}. Best is trial 11 with value: 6.785445509185266.
[I 2025-01-10 18:10:07,966] Trial 13 finished with value: 6.584873342878474 and parameters: {'scale': 0.018490815491456557, 'distribution': 'uniform', 'gravity': 0.006177654912975475, 'alpha': 0.02995664071381697, 'beta': 1.5370788327384435, 'probability': 0.8470528817405123, 'num_of_agents': 49}. Best is trial 13 with value: 6.584873342878474.
[I 2025-01-10 18:10:09,408] Trial 14 finished with value: 118.94824308118818 and parameters: {'scale': 0.056030568715735654, 'distribution': 'uniform', 'gravity': 0.006261886021753373, 'alpha': 0.027884435451955847, 'beta': 3.3851421704473665, 'probability': 0.8406568438490039, 'num_of_agents': 46}. Best is trial 13 with value: 6.584873342878474.
