Exit code: 0
Stdout:
Mejores hiperpar√°metros encontrados:
{'scale': 0.08985107511819446, 'distribution': 'gaussian', 'factor': 0.561069115388012, 'self_conf': 2.6973628820300117, 'swarm_conf': 2.3372082587889067, 'version': 'constriction', 'expression': 'current', 'num_rands': 1, 'gravity': 0.008763468373306858, 'alpha': 0.017271485518603295}
Mejor rendimiento encontrado:
79.51058377573798

Stderr:
[I 2025-01-30 20:11:48,690] A new study created in memory with name: no-name-5c9a009a-1db1-4883-a00f-55a65afad51c
/Users/valeriaenriquezlimon/Documents/meta-h-generator/llm-metaheuristics/.venv/lib/python3.12/site-packages/optuna/trial/_trial.py:678: RuntimeWarning: Inconsistent parameter values for distribution with name "factor"! This might be a configuration mistake. Optuna allows to call the same distribution with the same name more than once in a trial. When the parameter values are inconsistent optuna only uses the values of the first call and ignores all following. Using these values: {'step': None, 'low': 0.5, 'high': 1.5, 'log': False}
  warnings.warn(
[I 2025-01-30 20:11:52,568] Trial 0 finished with value: 79.6580363154583 and parameters: {'scale': 0.08437373724780792, 'distribution': 'uniform', 'factor': 1.095823351153952, 'self_conf': 1.6840449183926274, 'swarm_conf': 2.4770282698765995, 'version': 'inertial', 'expression': 'rand', 'num_rands': 3, 'gravity': 0.009198775043976176, 'alpha': 0.030676740604116494}. Best is trial 0 with value: 79.6580363154583.
[I 2025-01-30 20:11:56,453] Trial 1 finished with value: 79.61559830984663 and parameters: {'scale': 0.04846099709923185, 'distribution': 'uniform', 'factor': 0.6738900687834621, 'self_conf': 2.823995672050038, 'swarm_conf': 2.203428894619716, 'version': 'inertial', 'expression': 'rand', 'num_rands': 4, 'gravity': 0.0063679025043093355, 'alpha': 0.05871254597696092}. Best is trial 1 with value: 79.61559830984663.
[I 2025-01-30 20:12:00,361] Trial 2 finished with value: 79.54059414733305 and parameters: {'scale': 0.07683352800111397, 'distribution': 'gaussian', 'factor': 0.6504039884588981, 'self_conf': 2.160319000529122, 'swarm_conf': 2.7787698213679226, 'version': 'constriction', 'expression': 'best', 'num_rands': 3, 'gravity': 0.006121225262872017, 'alpha': 0.013010682386542977}. Best is trial 2 with value: 79.54059414733305.
[I 2025-01-30 20:12:04,243] Trial 3 finished with value: 79.51058377573798 and parameters: {'scale': 0.08985107511819446, 'distribution': 'gaussian', 'factor': 0.561069115388012, 'self_conf': 2.6973628820300117, 'swarm_conf': 2.3372082587889067, 'version': 'constriction', 'expression': 'current', 'num_rands': 1, 'gravity': 0.008763468373306858, 'alpha': 0.017271485518603295}. Best is trial 3 with value: 79.51058377573798.
[I 2025-01-30 20:12:08,259] Trial 4 finished with value: 80.25978150585715 and parameters: {'scale': 0.09813559845611114, 'distribution': 'levy', 'factor': 1.1483139631163939, 'self_conf': 2.678281413815151, 'swarm_conf': 2.606817033555827, 'version': 'inertial', 'expression': 'rand', 'num_rands': 5, 'gravity': 0.0025084565298199163, 'alpha': 0.015129890576523796}. Best is trial 3 with value: 79.51058377573798.
[I 2025-01-30 20:12:12,130] Trial 5 finished with value: 79.66509546516757 and parameters: {'scale': 0.0010001997278106837, 'distribution': 'gaussian', 'factor': 1.1500372768756373, 'self_conf': 1.437628729998583, 'swarm_conf': 1.66948733648009, 'version': 'inertial', 'expression': 'best', 'num_rands': 2, 'gravity': 0.003334629997963332, 'alpha': 0.07880757677811263}. Best is trial 3 with value: 79.51058377573798.
[I 2025-01-30 20:12:16,123] Trial 6 finished with value: 79.67212642730047 and parameters: {'scale': 0.0691538016511586, 'distribution': 'levy', 'factor': 0.541489382682416, 'self_conf': 1.7255053979869566, 'swarm_conf': 2.4071218596327393, 'version': 'inertial', 'expression': 'rand', 'num_rands': 4, 'gravity': 0.007229442916813914, 'alpha': 0.02420355760069597}. Best is trial 3 with value: 79.51058377573798.
[I 2025-01-30 20:12:20,069] Trial 7 finished with value: 79.7914398898998 and parameters: {'scale': 0.05363681330763653, 'distribution': 'levy', 'factor': 1.0586903125725273, 'self_conf': 2.1648531406307754, 'swarm_conf': 1.9680150008905113, 'version': 'constriction', 'expression': 'current', 'num_rands': 1, 'gravity': 0.0038148609073854686, 'alpha': 0.05340413066799848}. Best is trial 3 with value: 79.51058377573798.
[I 2025-01-30 20:12:24,038] Trial 8 finished with value: 79.84792969506468 and parameters: {'scale': 0.09562926834890224, 'distribution': 'levy', 'factor': 0.9760689364351788, 'self_conf': 1.4058679770172278, 'swarm_conf': 2.1750577256730868, 'version': 'inertial', 'expression': 'current', 'num_rands': 2, 'gravity': 0.004946787403529343, 'alpha': 0.05546943212505857}. Best is trial 3 with value: 79.51058377573798.
[I 2025-01-30 20:12:27,859] Trial 9 finished with value: 79.5713546697415 and parameters: {'scale': 0.010918424500549908, 'distribution': 'uniform', 'factor': 0.9091822916896272, 'self_conf': 2.961701870225798, 'swarm_conf': 1.6144720362718474, 'version': 'inertial', 'expression': 'current', 'num_rands': 1, 'gravity': 0.00272032859079593, 'alpha': 0.09327792050002569}. Best is trial 3 with value: 79.51058377573798.
