Exit code: 0
Stdout:
Mejores hiperpar√°metros encontrados:
{'scale': 0.029466137512283146, 'distribution': 'uniform', 'gravity': 0.000743488745905428, 'alpha': 0.019815779048483098, 'beta': 1.622184822468761, 'dt': 0.5771280890014836, 'expression': 'best', 'factor': 1.191357635226956}
Mejor rendimiento encontrado:
-52.34989640004887

Stderr:
[I 2025-03-30 14:26:06,041] A new study created in memory with name: no-name-44e0bf9f-58cc-4ad1-87a6-b109712ff459
/Users/valeriaenriquezlimon/Documents/meta-h-generator/llm-metaheuristics/.venv/lib/python3.12/site-packages/optuna/trial/_trial.py:678: RuntimeWarning: Inconsistent parameter values for distribution with name "gravity"! This might be a configuration mistake. Optuna allows to call the same distribution with the same name more than once in a trial. When the parameter values are inconsistent optuna only uses the values of the first call and ignores all following. Using these values: {'step': None, 'low': 0.0001, 'high': 0.01, 'log': False}
  warnings.warn(
/Users/valeriaenriquezlimon/Documents/meta-h-generator/llm-metaheuristics/.venv/lib/python3.12/site-packages/optuna/trial/_trial.py:678: RuntimeWarning: Inconsistent parameter values for distribution with name "alpha"! This might be a configuration mistake. Optuna allows to call the same distribution with the same name more than once in a trial. When the parameter values are inconsistent optuna only uses the values of the first call and ignores all following. Using these values: {'step': None, 'low': 0.005, 'high': 0.02, 'log': False}
  warnings.warn(
[I 2025-03-30 14:26:11,830] Trial 0 finished with value: -52.349718770377436 and parameters: {'scale': 0.006878090297270913, 'distribution': 'gaussian', 'gravity': 0.009128586953386078, 'alpha': 0.00858749476375107, 'beta': 1.9523337729836794, 'dt': 0.9045930256818461, 'expression': 'best', 'factor': 0.9145507299588107}. Best is trial 0 with value: -52.349718770377436.
[I 2025-03-30 14:26:17,201] Trial 1 finished with value: -52.349463325108154 and parameters: {'scale': 0.012045093700342922, 'distribution': 'levy', 'gravity': 0.0031736285534870214, 'alpha': 0.019384146241796137, 'beta': 1.807833175083375, 'dt': 1.486178719409939, 'expression': 'rand', 'factor': 0.9505238956214292}. Best is trial 0 with value: -52.349718770377436.
[I 2025-03-30 14:26:22,472] Trial 2 finished with value: -52.34989640004887 and parameters: {'scale': 0.029466137512283146, 'distribution': 'uniform', 'gravity': 0.000743488745905428, 'alpha': 0.019815779048483098, 'beta': 1.622184822468761, 'dt': 0.5771280890014836, 'expression': 'best', 'factor': 1.191357635226956}. Best is trial 2 with value: -52.34989640004887.
[I 2025-03-30 14:26:27,822] Trial 3 finished with value: -52.34756462535785 and parameters: {'scale': 0.029065988400496724, 'distribution': 'uniform', 'gravity': 0.0031275978304102564, 'alpha': 0.019253302033245278, 'beta': 2.5088726423564074, 'dt': 1.478392802769915, 'expression': 'current', 'factor': 0.6856577822822597}. Best is trial 2 with value: -52.34989640004887.
[I 2025-03-30 14:26:33,077] Trial 4 finished with value: -52.34954344007476 and parameters: {'scale': 0.021618004224564332, 'distribution': 'gaussian', 'gravity': 0.009343964488486137, 'alpha': 0.006978254004224842, 'beta': 1.473185544454585, 'dt': 0.9860740431803379, 'expression': 'best', 'factor': 1.2064746897501974}. Best is trial 2 with value: -52.34989640004887.
[I 2025-03-30 14:26:38,295] Trial 5 finished with value: -52.34477533438467 and parameters: {'scale': 0.017743459001656723, 'distribution': 'levy', 'gravity': 0.007310536312432411, 'alpha': 0.016997007371111653, 'beta': 2.6047514487301564, 'dt': 0.8890709306834867, 'expression': 'rand-to-best', 'factor': 1.1905712095474574}. Best is trial 2 with value: -52.34989640004887.
[I 2025-03-30 14:26:43,634] Trial 6 finished with value: -52.349414428216384 and parameters: {'scale': 0.025555696716054857, 'distribution': 'levy', 'gravity': 0.008976877494343448, 'alpha': 0.015762597189383606, 'beta': 1.4181181878617979, 'dt': 0.8441684530864266, 'expression': 'rand-to-best', 'factor': 1.4427369284839497}. Best is trial 2 with value: -52.34989640004887.
[I 2025-03-30 14:26:48,889] Trial 7 finished with value: -52.34988170742441 and parameters: {'scale': 0.005689033092162896, 'distribution': 'gaussian', 'gravity': 0.006078210880928633, 'alpha': 0.008668344855931693, 'beta': 1.4465713153157416, 'dt': 0.7949742915090474, 'expression': 'best', 'factor': 1.2452014560556264}. Best is trial 2 with value: -52.34989640004887.
[I 2025-03-30 14:26:54,131] Trial 8 finished with value: -52.349823754695244 and parameters: {'scale': 0.03022259346341272, 'distribution': 'gaussian', 'gravity': 0.009779919806738716, 'alpha': 0.009737999360349463, 'beta': 1.0845787170905874, 'dt': 1.3504991105869564, 'expression': 'rand', 'factor': 0.726045397174705}. Best is trial 2 with value: -52.34989640004887.
[I 2025-03-30 14:26:59,320] Trial 9 finished with value: -52.34744471612817 and parameters: {'scale': 0.04581603403230424, 'distribution': 'uniform', 'gravity': 0.0016048157853484912, 'alpha': 0.015039053582490435, 'beta': 3.372378586950315, 'dt': 1.2719993338730413, 'expression': 'best', 'factor': 1.358821421221859}. Best is trial 2 with value: -52.34989640004887.
