Exit code: 0
Stdout:
Mejores hiperpar√°metros encontrados:
{'scale': 0.010887052586138157, 'distribution': 'gaussian', 'gravity': 0.6471255871906095, 'alpha': 0.0853983852579416, 'beta': 3.26089739544329, 'factor': 0.9115442548331075, 'self_conf': 2.7792898675730777, 'swarm_conf': 2.258993486403508, 'version': 'constriction'}
Mejor rendimiento encontrado:
-16.929156839015985

Stderr:
[I 2025-04-06 15:27:39,853] A new study created in memory with name: no-name-8b665fdc-b399-45fe-bc06-bd83f7f76b5f
/Users/valeriaenriquezlimon/Documents/meta-h-generator/llm-metaheuristics/.venv/lib/python3.12/site-packages/optuna/trial/_trial.py:678: RuntimeWarning: Inconsistent parameter values for distribution with name "alpha"! This might be a configuration mistake. Optuna allows to call the same distribution with the same name more than once in a trial. When the parameter values are inconsistent optuna only uses the values of the first call and ignores all following. Using these values: {'step': None, 'low': 0.03, 'high': 0.1, 'log': False}
  warnings.warn(
[I 2025-04-06 15:27:44,964] Trial 0 finished with value: -16.564541307579706 and parameters: {'scale': 0.013252839997215493, 'distribution': 'gaussian', 'gravity': 0.7655404795020497, 'alpha': 0.032860737644801546, 'beta': 2.0215381612090244, 'factor': 0.9224939498929573, 'self_conf': 2.5616014855128397, 'swarm_conf': 2.3363890513470613, 'version': 'inertial'}. Best is trial 0 with value: -16.564541307579706.
[I 2025-04-06 15:27:50,076] Trial 1 finished with value: -16.92538182138075 and parameters: {'scale': 0.019416297570332475, 'distribution': 'uniform', 'gravity': 0.7342564291371669, 'alpha': 0.0718428480057188, 'beta': 3.5203732277184776, 'factor': 0.9307719293906498, 'self_conf': 2.57384125966393, 'swarm_conf': 2.042817396837304, 'version': 'constriction'}. Best is trial 1 with value: -16.92538182138075.
[I 2025-04-06 15:27:55,141] Trial 2 finished with value: -16.57160062914831 and parameters: {'scale': 0.019375333748538608, 'distribution': 'uniform', 'gravity': 0.7372038642437884, 'alpha': 0.09583895187348353, 'beta': 3.732494541347387, 'factor': 0.9348627910676821, 'self_conf': 2.5872230153651534, 'swarm_conf': 2.3481689430064803, 'version': 'inertial'}. Best is trial 1 with value: -16.92538182138075.
[I 2025-04-06 15:28:00,222] Trial 3 finished with value: -16.523230196661338 and parameters: {'scale': 0.023750664722124053, 'distribution': 'gaussian', 'gravity': 0.7939766280413604, 'alpha': 0.07176176953351696, 'beta': 1.9864389291354436, 'factor': 0.9485685360602065, 'self_conf': 2.9352796323066395, 'swarm_conf': 2.229593047215161, 'version': 'inertial'}. Best is trial 1 with value: -16.92538182138075.
[I 2025-04-06 15:28:05,345] Trial 4 finished with value: -16.920610164154493 and parameters: {'scale': 0.032731333594291596, 'distribution': 'gaussian', 'gravity': 0.7525480105892798, 'alpha': 0.04001209040005966, 'beta': 3.787431302326943, 'factor': 0.9196561253982302, 'self_conf': 2.846594761883675, 'swarm_conf': 2.440437384669644, 'version': 'constriction'}. Best is trial 1 with value: -16.92538182138075.
[I 2025-04-06 15:28:10,406] Trial 5 finished with value: -16.702701209487277 and parameters: {'scale': 0.010481367631514136, 'distribution': 'uniform', 'gravity': 0.6494273638395266, 'alpha': 0.051211044296053124, 'beta': 2.700328472453974, 'factor': 0.939080722009596, 'self_conf': 2.5163565579043325, 'swarm_conf': 2.2464538222982067, 'version': 'inertial'}. Best is trial 1 with value: -16.92538182138075.
[I 2025-04-06 15:28:15,478] Trial 6 finished with value: -16.499108239686354 and parameters: {'scale': 0.04830513360031915, 'distribution': 'gaussian', 'gravity': 0.7031467029674278, 'alpha': 0.07403338760036617, 'beta': 3.216967335890839, 'factor': 0.9408863515964161, 'self_conf': 2.8321295581123005, 'swarm_conf': 2.264175547210028, 'version': 'inertial'}. Best is trial 1 with value: -16.92538182138075.
[I 2025-04-06 15:28:20,599] Trial 7 finished with value: -16.926436457492173 and parameters: {'scale': 0.02351511357018978, 'distribution': 'gaussian', 'gravity': 0.7246041742531838, 'alpha': 0.03382500165568562, 'beta': 2.084976499430029, 'factor': 0.9148773959283469, 'self_conf': 2.898143087325798, 'swarm_conf': 2.025883996365297, 'version': 'constriction'}. Best is trial 7 with value: -16.926436457492173.
[I 2025-04-06 15:28:25,709] Trial 8 finished with value: -16.929156839015985 and parameters: {'scale': 0.010887052586138157, 'distribution': 'gaussian', 'gravity': 0.6471255871906095, 'alpha': 0.0853983852579416, 'beta': 3.26089739544329, 'factor': 0.9115442548331075, 'self_conf': 2.7792898675730777, 'swarm_conf': 2.258993486403508, 'version': 'constriction'}. Best is trial 8 with value: -16.929156839015985.
[I 2025-04-06 15:28:30,824] Trial 9 finished with value: -16.92615714876317 and parameters: {'scale': 0.04249872593584073, 'distribution': 'gaussian', 'gravity': 0.6756897987650022, 'alpha': 0.05209997729204251, 'beta': 4.348075482265369, 'factor': 0.9129670788471532, 'self_conf': 2.808338893192429, 'swarm_conf': 2.306131391289118, 'version': 'constriction'}. Best is trial 8 with value: -16.929156839015985.
