Exit code: 0
Stdout:
Mejores hiperpar√°metros encontrados:
{'scale': 0.0029471631772266652, 'distribution': 'gaussian', 'gravity': 0.005005995092561471, 'alpha': 0.036924719913383475, 'beta': 1.5, 'dt': 0.37926233706097146, 'expression': 'best', 'num_rands': 3, 'factor': 1.6805006569732313}
Mejor rendimiento encontrado:
-52.349723904048254

Stderr:
[I 2025-03-30 09:39:54,966] A new study created in memory with name: no-name-7827299d-3dce-4ee1-a7ab-2eb9c9b28f40
/opt/anaconda3/lib/python3.12/site-packages/optuna/trial/_trial.py:678: RuntimeWarning: Inconsistent parameter values for distribution with name "gravity"! This might be a configuration mistake. Optuna allows to call the same distribution with the same name more than once in a trial. When the parameter values are inconsistent optuna only uses the values of the first call and ignores all following. Using these values: {'step': None, 'low': 0.001, 'high': 0.01, 'log': False}
  warnings.warn(
/opt/anaconda3/lib/python3.12/site-packages/optuna/trial/_trial.py:678: RuntimeWarning: Inconsistent parameter values for distribution with name "alpha"! This might be a configuration mistake. Optuna allows to call the same distribution with the same name more than once in a trial. When the parameter values are inconsistent optuna only uses the values of the first call and ignores all following. Using these values: {'step': None, 'low': 0.01, 'high': 0.2, 'log': False}
  warnings.warn(
[I 2025-03-30 09:40:01,688] Trial 0 finished with value: -52.34898784125145 and parameters: {'scale': 0.08411718219273592, 'distribution': 'gaussian', 'gravity': 0.003500877235166777, 'alpha': 0.1896923095833229, 'beta': 2.0, 'dt': 0.9328909882157866, 'expression': 'rand-to-best-and-current', 'num_rands': 3, 'factor': 1.7860244729418766}. Best is trial 0 with value: -52.34898784125145.
[I 2025-03-30 09:40:06,852] Trial 1 finished with value: -52.348346279632665 and parameters: {'scale': 0.006661778371526291, 'distribution': 'uniform', 'gravity': 0.003837388703577475, 'alpha': 0.09980662140279202, 'beta': 2.5, 'dt': 0.6708389628689471, 'expression': 'rand-to-best-and-current', 'num_rands': 2, 'factor': 1.0533361073514576}. Best is trial 0 with value: -52.34898784125145.
[I 2025-03-30 09:40:12,332] Trial 2 finished with value: -52.34894284782622 and parameters: {'scale': 0.08509628693560645, 'distribution': 'uniform', 'gravity': 0.0012186960029956795, 'alpha': 0.19773634698918405, 'beta': 2.5, 'dt': 0.6021071436240241, 'expression': 'best', 'num_rands': 1, 'factor': 1.139960444879201}. Best is trial 0 with value: -52.34898784125145.
[I 2025-03-30 09:40:17,966] Trial 3 finished with value: -52.34893171472857 and parameters: {'scale': 0.09771327730393807, 'distribution': 'gaussian', 'gravity': 0.0012319664003940666, 'alpha': 0.031151090535841017, 'beta': 2.5, 'dt': 0.3494366101479735, 'expression': 'rand', 'num_rands': 3, 'factor': 1.8148843700520088}. Best is trial 0 with value: -52.34898784125145.
[I 2025-03-30 09:40:23,594] Trial 4 finished with value: -52.349723904048254 and parameters: {'scale': 0.0029471631772266652, 'distribution': 'gaussian', 'gravity': 0.005005995092561471, 'alpha': 0.036924719913383475, 'beta': 1.5, 'dt': 0.37926233706097146, 'expression': 'best', 'num_rands': 3, 'factor': 1.6805006569732313}. Best is trial 4 with value: -52.349723904048254.
[I 2025-03-30 09:40:29,008] Trial 5 finished with value: -52.34948389783587 and parameters: {'scale': 0.004900228109966752, 'distribution': 'uniform', 'gravity': 0.008963097297434379, 'alpha': 0.030286101929973774, 'beta': 1.5, 'dt': 0.44889571225678426, 'expression': 'rand-to-best', 'num_rands': 3, 'factor': 1.4109701812234554}. Best is trial 4 with value: -52.349723904048254.
[I 2025-03-30 09:40:34,600] Trial 6 finished with value: -52.34885868728843 and parameters: {'scale': 0.04239226065242295, 'distribution': 'uniform', 'gravity': 0.001419210556788368, 'alpha': 0.040106630202662974, 'beta': 2.5, 'dt': 0.48456185721763234, 'expression': 'rand', 'num_rands': 2, 'factor': 1.0454522129563977}. Best is trial 4 with value: -52.349723904048254.
[I 2025-03-30 09:40:40,063] Trial 7 finished with value: -52.348867982596666 and parameters: {'scale': 0.03335595404632344, 'distribution': 'gaussian', 'gravity': 0.00388875999968662, 'alpha': 0.15303079101701766, 'beta': 2.0, 'dt': 0.48227014091511644, 'expression': 'rand-to-best-and-current', 'num_rands': 1, 'factor': 1.0536749366416078}. Best is trial 4 with value: -52.349723904048254.
[I 2025-03-30 09:40:45,964] Trial 8 finished with value: -52.34895650293351 and parameters: {'scale': 0.05326514602030186, 'distribution': 'uniform', 'gravity': 0.008907357662378552, 'alpha': 0.10200027362473357, 'beta': 1.5, 'dt': 0.6630139990635006, 'expression': 'current', 'num_rands': 2, 'factor': 1.7974361952925797}. Best is trial 4 with value: -52.349723904048254.
[I 2025-03-30 09:40:51,369] Trial 9 finished with value: -52.34861602413128 and parameters: {'scale': 0.09171003574642218, 'distribution': 'gaussian', 'gravity': 0.009334462522712087, 'alpha': 0.15684022608932144, 'beta': 1.5, 'dt': 0.46367551265978485, 'expression': 'current', 'num_rands': 3, 'factor': 1.8609047881345984}. Best is trial 4 with value: -52.349723904048254.
